weapon_used	weapon_result	charge	location_major_comm	location_comm	date_of_occurrence	time_of_occurrance	disposition	status	towncode	day_occur	armedrob	burglary	aggassault	simpleassault	sexual	domestic_phys	domestic_verbal	land	land_violent	mob	riot	murder	other	year	month
"NIL"	"NIL"	"AGGRAVATED ASSAULT"	"PAYNESVILLE"	"OUTLAND COMMUNITY"	"12/21/2017"	"03:00 PM - 06:00 PM"	"COURT"	"COMPLETED"	5004	"2017-12-21"	0	0	1	0	0	0	0	0	0	0	0	0	0	2017	12
"NIL"	"NIL"	"SIMPLE ASSAULT"	"BUSHROD ISLAND"	"CLARA TOWN COMMUNITY"	"9/4/2017"	"12:00 PM - 03:00 PM"	"WITHDRAWN "	"COMPLETED"	10002	"2017-09-04"	0	0	0	1	0	0	0	0	0	0	0	0	0	2017	9
"NIL"	"NIL"	"CRIMINAL MISCHIEF"	"PAYNESVILLE"	"ROCK HILL COMMUNITY"	"4/8/2018"	"12:00 PM - 03:00 PM"	"PENDING"	"COMPLETED"	2014	"2018-04-08"	0	0	0	0	0	0	0	0	0	0	0	0	1	2018	4
"NIL"	"NIL"	"PROPERTY THEFT"	"CENTRAL MONROVIA"	"CAREY STREET COMMUNITY"	"6/4/2017"	"09:00 AM - 12:00 PM"	"WITHDRAWN"	"COMPLETED"	2010	"2017-06-04"	0	0	0	0	0	0	0	0	0	0	0	0	1	2017	6
"NIL"	"NIL"	"AGGRAVATED ASSAULT"	"BUSHROD ISLAND"	"NEW GEORGIA COMMUNITY"	"6/3/2017"	"09:00 PM - 00:00 AM"	"COURT"	"COMPLETED"	4020	"2017-06-03"	0	0	1	0	0	0	0	0	0	0	0	0	0	2017	6
"NIL"	"NIL"	"MISAPPLICATION OF ENTRUSTED PROPERTY"	"BUSHROD ISLAND"	"NEW GEORGIA COMMUNITY"	"6/3/2017"	"09:00 AM - 12:00 PM"	"PENDING"	"COMPLETED"	4020	"2017-06-03"	0	1	0	0	0	0	0	0	0	0	0	0	0	2017	6
"NIL"	"NIL"	"CRIMINAL MISCHIEF"	"PAYNESVILLE"	"NEEZOE COMMUNITY"	"6/13/2017"	"09:00 AM - 12:00 PM"	"PENDING"	"COMPLETED"	9018	"2017-06-13"	0	0	0	0	0	0	0	0	0	0	0	0	1	2017	6
"NIL"	"NIL"	"PROPERTY THEFT"	"CENTRAL MONROVIA"	"MECHLIN STREET COMMUNITY"	"6/3/2017"	"03:00 PM - 06:00 PM"	"WITHDRAWN"	"COMPLETED"	2005	"2017-06-03"	0	0	0	0	0	0	0	0	0	0	0	0	1	2017	6
"NIL"	"NIL"	"PROPERTY THEFT"	"CENTRAL MONROVIA"	"UN DRIVE COMMUNITY"	"6/2/2017"	"09:00 AM - 12:00 PM"	"WITHDRAWN"	"COMPLETED"	2001	"2017-06-02"	0	0	0	0	0	0	0	0	0	0	0	0	1	2017	6
"NIL"	"NIL"	"MENACING"	"BUSHROD ISLAND"	"JAMAICA ROAD COMMUNITY"	"6/3/2017"	"09:00 AM - 12:00 PM"	"WITHDRAWN"	"COMPLETED"	10020	"2017-06-03"	0	0	0	0	0	0	0	0	0	0	0	0	1	2017	6
"NIL"	"NIL"	"PROPERTY THEFT"	"BUSHROD ISLAND"	"CLARA TOWN COMMUNITY"	"6/3/2017"	"12:00 PM - 03:00 PM"	"WITHDRAWN"	"COMPLETED"	10002	"2017-06-03"	0	0	0	0	0	0	0	0	0	0	0	0	1	2017	6
"NIL"	"NIL"	"PROPERTY THEFT"	"PAYNESVILLE"	"SKD BOULEVARD COMMUNITY"	"6/9/2017"	"09:00 AM - 12:00 PM"	"PENDING"	"COMPLETED"	3014	"2017-06-09"	0	0	0	0	0	0	0	0	0	0	0	0	1	2017	6
"NIL"	"NIL"	"PROPERTY THEFT"	"CONGO TOWN"	"PEACE ISLAND COMMUNITY"	"6/10/2017"	"03:00 AM - 06:00 AM"	"PENDING"	"COMPLETED"	3000	"2017-06-10"	0	0	0	0	0	0	0	0	0	0	0	0	1	2017	6
"NIL"	"NIL"	"PROPERTY THEFT"	"CONGO TOWN"	"PEACE ISLAND COMMUNITY"	"6/12/2017"	"12:00 PM - 03:00 PM"	"PENDING"	"COMPLETED"	3000	"2017-06-12"	0	0	0	0	0	0	0	0	0	0	0	0	1	2017	6
"NIL"	"NIL"	"AGGRAVATED ASSAULT"	"PAYNESVILLE"	"ELWA COMMUNITY"	"6/5/2017"	"12:00 PM - 03:00 PM"	"PENDING"	"COMPLETED"	8005	"2017-06-05"	0	0	1	0	0	0	0	0	0	0	0	0	0	2017	6
"NIL"	"NIL"	"PROPERTY THEFT"	"PAYNESVILLE"	"ELWA COMMUNITY"	"6/9/2017"	"09:00 AM - 12:00 PM"	"WITHDRAWN"	"COMPLETED"	8005	"2017-06-09"	0	0	0	0	0	0	0	0	0	0	0	0	1	2017	6
"NIL"	"NIL"	"AGGRAVATED ASSAULT"	"BUSHROD ISLAND"	"DOE COMMUNITY"	"6/2/2017"	"06:00 AM - 09:00 AM"	"COURT"	"COMPLETED"	10004	"2017-06-02"	0	0	1	0	0	0	0	0	0	0	0	0	0	2017	6
"NIL"	"NIL"	"AGGRAVATED ASSAULT"	"BUSHROD ISLAND"	"DOE COMMUNITY"	"6/4/2017"	"03:00 PM - 06:00 PM"	"COURT"	"COMPLETED"	10004	"2017-06-04"	0	0	1	0	0	0	0	0	0	0	0	0	0	2017	6
"NIL"	"NIL"	"AGGRAVATED ASSAULT"	"BUSHROD ISLAND"	"DOE COMMUNITY"	"6/5/2017"	"09:00 AM - 12:00 PM"	"COURT"	"COMPLETED"	10004	"2017-06-05"	0	0	1	0	0	0	0	0	0	0	0	0	0	2017	6
"NIL"	"NIL"	"SIMPLE ASSAULT"	"BUSHROD ISLAND"	"DOE COMMUNITY"	"6/6/2017"	"12:00 PM - 03:00 PM"	"WITHDRAWN"	"COMPLETED"	10004	"2017-06-06"	0	0	0	1	0	0	0	0	0	0	0	0	0	2017	6
"NIL"	"NIL"	"SIMPLE ASSAULT"	"BUSHROD ISLAND"	"CLARA TOWN COMMUNITY"	"6/8/2017"	"12:00 PM - 03:00 PM"	"WITHDRAWN"	"COMPLETED"	10002	"2017-06-08"	0	0	0	1	0	0	0	0	0	0	0	0	0	2017	6
"NIL"	"NIL"	"SIMPLE ASSAULT"	"BUSHROD ISLAND"	"DOE COMMUNITY"	"6/9/2017"	"09:00 AM - 12:00 PM"	"COURT"	"COMPLETED"	10004	"2017-06-09"	0	0	0	1	0	0	0	0	0	0	0	0	0	2017	6
"NIL"	"NIL"	"SIMPLE ASSAULT"	"BUSHROD ISLAND"	"CLARA TOWN COMMUNITY"	"6/11/2017"	"03:00 PM - 06:00 PM"	"COURT"	"COMPLETED"	10002	"2017-06-11"	0	0	0	1	0	0	0	0	0	0	0	0	0	2017	6
"NIL"	"NIL"	"SIMPLE ASSAULT"	"BUSHROD ISLAND"	"DOE COMMUNITY"	"6/12/2017"	"12:00 PM - 03:00 PM"	"PENDING"	"COMPLETED"	10004	"2017-06-12"	0	0	0	1	0	0	0	0	0	0	0	0	0	2017	6
"NIL"	"NIL"	"SIMPLE ASSAULT"	"BUSHROD ISLAND"	"DOE COMMUNITY"	"6/13/2017"	"03:00 PM - 06:00 PM"	"COURT"	"COMPLETED"	10004	"2017-06-13"	0	0	0	1	0	0	0	0	0	0	0	0	0	2017	6
"NIL"	"NIL"	"PROPERTY THEFT"	"BUSHROD ISLAND"	"CLARA TOWN COMMUNITY"	"6/15/2017"	"06:00 PM - 09:00 PM"	"COURT"	"COMPLETED"	10002	"2017-06-15"	0	0	0	0	0	0	0	0	0	0	0	0	1	2017	6
"NIL"	"NIL"	"PROPERTY THEFT"	"BUSHROD ISLAND"	"CLARA TOWN COMMUNITY"	"6/17/2017"	"12:00 PM - 03:00 PM"	"COURT"	"COMPLETED"	10002	"2017-06-17"	0	0	0	0	0	0	0	0	0	0	0	0	1	2017	6
"NIL"	"NIL"	"PROPERTY THEFT"	"BUSHROD ISLAND"	"CLARA TOWN COMMUNITY"	"6/17/2017"	"12:00 PM - 03:00 PM"	"WITHDRAWN"	"COMPLETED"	10002	"2017-06-17"	0	0	0	0	0	0	0	0	0	0	0	0	1	2017	6
"NIL"	"NIL"	"PROPERTY THEFT"	"BUSHROD ISLAND"	"CLARA TOWN COMMUNITY"	"6/17/2017"	"12:00 PM - 03:00 PM"	"PENDING"	"COMPLETED"	10002	"2017-06-17"	0	0	0	0	0	0	0	0	0	0	0	0	1	2017	6
"NIL"	"NIL"	"DISORDERLY CONDUCT"	"BUSHROD ISLAND"	"DOE COMMUNITY"	"6/18/2017"	"09:00 AM - 12:00 PM"	"WITHDRAWN"	"COMPLETED"	10004	"2017-06-18"	0	0	0	0	0	0	0	0	0	0	0	0	1	2017	6
"NIL"	"NIL"	"DISORDERLY CONDUCT"	"BUSHROD ISLAND"	"DOE COMMUNITY"	"6/19/2017"	"09:00 PM - 00:00 AM"	"WITHDRAWN"	"COMPLETED"	10004	"2017-06-19"	0	0	0	0	0	0	0	0	0	0	0	0	1	2017	6
"NIL"	"NIL"	"DISORDERLY CONDUCT"	"BUSHROD ISLAND"	"DOE COMMUNITY"	"6/20/2017"	"12:00 PM - 03:00 PM"	"WITHDRAWN"	"COMPLETED"	10004	"2017-06-20"	0	0	0	0	0	0	0	0	0	0	0	0	1	2017	6
"NIL"	"NIL"	"PROPERTY THEFT"	"BUSHROD ISLAND"	"DUALA COMMUNITY"	"6/8/2017"	"12:00 PM - 03:00 PM"	"COURT"	"COMPLETED"	1014	"2017-06-08"	0	0	0	0	0	0	0	0	0	0	0	0	1	2017	6
"NIL"	"NIL"	"AGGRAVATED ASSAULT"	"BUSHROD ISLAND"	"BONG MINES BRIDGE COMMUNITY"	"6/2/2017"	"06:00 PM - 09:00 PM"	"COURT"	"COMPLETED"	1002	"2017-06-02"	0	0	1	0	0	0	0	0	0	0	0	0	0	2017	6
"NIL"	"NIL"	"BURGLARY"	"BUSHROD ISLAND"	"POINT FOUR COMMUNITY"	"6/4/2017"	"03:00 PM - 06:00 PM"	"PENDING"	"COMPLETED"	1001	"2017-06-04"	0	1	0	0	0	0	0	0	0	0	0	0	0	2017	6
"NIL"	"NIL"	"AGGRAVATED ASSAULT"	"BUSHROD ISLAND"	"BONG MINES BRIDGE COMMUNITY"	"6/5/2017"	"06:00 PM - 09:00 PM"	"COURT"	"COMPLETED"	1002	"2017-06-05"	0	0	1	0	0	0	0	0	0	0	0	0	0	2017	6
"NIL"	"NIL"	"PROPERTY THEFT"	"BUSHROD ISLAND"	"DUALA COMMUNITY"	"6/3/2017"	"09:00 AM - 12:00 PM"	"COURT"	"COMPLETED"	1014	"2017-06-03"	0	0	0	0	0	0	0	0	0	0	0	0	1	2017	6
"NIL"	"NIL"	"PROPERTY THEFT"	"BUSHROD ISLAND"	"POINT FOUR COMMUNITY"	"6/6/2017"	"06:00 AM - 09:00 AM"	"COURT"	"COMPLETED"	1001	"2017-06-06"	0	0	0	0	0	0	0	0	0	0	0	0	1	2017	6
"NIL"	"NIL"	"PROPERTY THEFT"	"PAYNESVILLE"	"72ND COMMUNITY"	"6/3/2017"	"06:00 AM - 09:00 AM"	"COURT"	"COMPLETED"	9012	"2017-06-03"	0	0	0	0	0	0	0	0	0	0	0	0	1	2017	6
"NIL"	"NIL"	"PROPERTY THEFT"	"BREWERVILLE"	"BABYMA JUNCTION COMMUNITY"	"6/4/2017"	"12:00 PM - 03:00 PM"	"WITHDRAWN"	"COMPLETED"	6003	"2017-06-04"	0	0	0	0	0	0	0	0	0	0	0	0	1	2017	6
"NIL"	"NIL"	"ROBBERY"	"BREWERVILLE"	"BABYMA JUNCTION COMMUNITY"	"6/18/2017"	"12:00 PM - 03:00 PM"	"PENDING"	"COMPLETED"	6003	"2017-06-18"	0	1	0	0	0	0	0	0	0	0	0	0	0	2017	6
"NIL"	"NIL"	"PROPERTY THEFT"	"BUSHROD ISLAND"	"JAMAICA ROAD COMMUNITY"	"6/9/2017"	"03:00 PM - 06:00 PM"	"PENDING"	"COMPLETED"	10020	"2017-06-09"	0	0	0	0	0	0	0	0	0	0	0	0	1	2017	6
"NIL"	"NIL"	"BURGLARY"	"BUSHROD ISLAND"	"DOE COMMUNITY"	"6/14/2017"	"09:00 AM - 12:00 PM"	"WITHDRAWN"	"COMPLETED"	10004	"2017-06-14"	0	1	0	0	0	0	0	0	0	0	0	0	0	2017	6
"NIL"	"NIL"	"BURGLARY"	"BUSHROD ISLAND"	"JAMAICA ROAD COMMUNITY"	"6/10/2017"	"12:00 PM - 03:00 PM"	"COURT"	"COMPLETED"	10020	"2017-06-10"	0	1	0	0	0	0	0	0	0	0	0	0	0	2017	6
"NIL"	"NIL"	"PROPERTY THEFT"	"BUSHROD ISLAND"	"DUALA COMMUNITY"	"6/5/2017"	"06:00 PM - 09:00 PM"	"WITHDRAWN"	"COMPLETED"	1014	"2017-06-05"	0	0	0	0	0	0	0	0	0	0	0	0	1	2017	6
"NIL"	"NIL"	"PROPERTY THEFT"	"PAYNESVILLE"	"ELWA COMMUNITY"	"6/10/2017"	"09:00 AM - 12:00 PM"	"WITHDRAWN"	"COMPLETED"	8005	"2017-06-10"	0	0	0	0	0	0	0	0	0	0	0	0	1	2017	6
"NIL"	"NIL"	"PROPERTY THEFT"	"PAYNESVILLE"	"72ND COMMUNITY"	"6/30/2017"	"09:00 AM - 12:00 PM"	"COURT"	"COMPLETED"	9012	"2017-06-30"	0	0	0	0	0	0	0	0	0	0	0	0	1	2017	6
"NIL"	"NIL"	"PROPERTY THEFT"	"PAYNESVILLE"	"72ND COMMUNITY"	"6/5/2017"	"06:00 PM - 09:00 PM"	"WITHDRAWN"	"COMPLETED"	9012	"2017-06-05"	0	0	0	0	0	0	0	0	0	0	0	0	1	2017	6
"NIL"	"NIL"	"SIMPLE ASSAULT"	"PAYNESVILLE"	"72ND COMMUNITY"	"6/7/2017"	"06:00 PM - 09:00 PM"	"WITHDRAWN"	"COMPLETED"	9012	"2017-06-07"	0	0	0	1	0	0	0	0	0	0	0	0	0	2017	6
"NIL"	"NIL"	"PROPERTY THEFT"	"PAYNESVILLE"	"NEW HOPE COMMUNITY"	"6/16/2017"	"12:00 PM - 03:00 PM"	"WITHDRAWN"	"COMPLETED"	9003	"2017-06-16"	0	0	0	0	0	0	0	0	0	0	0	0	1	2017	6
"NIL"	"NIL"	"PERSISTANT NON SUPORT"	"BUSHROD ISLAND"	"CLARA TOWN COMMUNITY"	"6/9/2017"	"06:00 AM - 09:00 AM"	"COURT"	"COMPLETED"	10002	"2017-06-09"	0	0	0	0	0	0	0	0	0	0	0	0	1	2017	6
"NIL"	"NIL"	"AGGRAVATED ASSAULT"	"PAYNESVILLE"	"GSA COMMUNITY"	"6/2/2017"	"03:00 PM - 06:00 PM"	"WITHDRAWN"	"COMPLETED"	5002	"2017-06-02"	0	0	1	0	0	0	0	0	0	0	0	0	0	2017	6
"NIL"	"NIL"	"SIMPLE ASSAULT"	"PAYNESVILLE"	"GSA COMMUNITY"	"6/16/2017"	"09:00 AM - 12:00 PM"	"PENDING"	"COMPLETED"	5002	"2017-06-16"	0	0	0	1	0	0	0	0	0	0	0	0	0	2017	6
"NIL"	"NIL"	"RAPE"	"PAYNESVILLE"	"POLICE ACADEMY "	"6/16/2017"	"09:00 AM - 12:00 PM"	"PENDING"	"COMPLETED"	5010	"2017-06-16"	0	0	0	0	1	0	0	0	0	0	0	0	0	2017	6
"NIL"	"NIL"	"INTERFERING WITH CHILD CUSTODY"	"BUSHROD ISLAND"	"THUMBS UP COMMUNITY"	"6/6/2017"	"03:00 PM - 06:00 PM"	"WITHDRAWN"	"COMPLETED"	7007	"2017-06-06"	0	0	0	0	0	0	0	0	0	0	0	0	1	2017	6
"NIL"	"NIL"	"SIMPLE ASSAULT"	"BUSHROD ISLAND"	"NEW GEORGIA COMMUNITY"	"6/9/2017"	"12:00 PM - 03:00 PM"	"COURT"	"COMPLETED"	4020	"2017-06-09"	0	0	0	1	0	0	0	0	0	0	0	0	0	2017	6
"NILL"	"NILL "	"PROPERTY THEFT"	"PAYNESVILLE"	"ELWA COMMUNITY"	"6/10/2017"	"09:00 PM - 00:00 AM"	"COURT"	"COMPLETED "	8005	"2017-06-10"	0	0	0	0	0	0	0	0	0	0	0	0	1	2017	6
"NILL"	"NILL "	"PROPERTY THEFT"	"PAYNESVILLE"	"THINKER VILLAGE COMMUNITY"	"6/11/2017"	"06:00 AM - 09:00 AM"	"COURT"	"COMPLETED "	8013	"2017-06-11"	0	0	0	0	0	0	0	0	0	0	0	0	1	2017	6
"NILL"	"NILL "	"CRIMINAL COERCION"	"PAYNESVILLE"	"GSA ROAD COMMUNITY"	"6/14/2017"	"09:00 AM - 12:00 PM"	"COURT"	"COMPLETED "	5002	"2017-06-14"	0	0	0	0	0	0	0	0	0	0	0	0	1	2017	6
"NILL"	"NILL "	"PROPERTY THEFT"	"PAYNESVILLE"	"SOUL CLINIC COMMUNITY"	"6/2/2017"	"12:00 PM - 03:00 PM"	"WITHDRAWN"	"COMPLETED "	5014	"2017-06-02"	0	0	0	0	0	0	0	0	0	0	0	0	1	2017	6
"NILL"	"NILL "	"CRIMINAL MISCHIEF"	"PAYNESVILLE"	"SOUL CLINIC COMMUNITY"	"6/2/2017"	"12:00 PM - 03:00 PM"	"WITHDRAWN"	"COMPLETED "	5014	"2017-06-02"	0	0	0	0	0	0	0	0	0	0	0	0	1	2017	6
"NILL"	"NILL "	"PROPERTY THEFT"	"PAYNESVILLE"	"SOUL CLINIC COMMUNITY"	"6/7/2017"	"06:00 AM - 09:00 AM"	"WITHDRAWN"	"COMPLETED "	5014	"2017-06-07"	0	0	0	0	0	0	0	0	0	0	0	0	1	2017	6
"NILL"	"NILL "	"PROPERTY THEFT"	"PAYNESVILLE"	"SOUL CLINIC COMMUNITY"	"6/8/2017"	"06:00 AM - 09:00 AM"	"WITHDRAWN"	"COMPLETED "	5014	"2017-06-08"	0	0	0	0	0	0	0	0	0	0	0	0	1	2017	6
"NILL"	"NILL "	"MENACING"	"PAYNESVILLE"	"SOUL CLINIC COMMUNITY"	"6/8/2017"	"06:00 AM - 09:00 AM"	"WITHDRAWN"	"COMPLETED "	5014	"2017-06-08"	0	0	0	0	0	0	0	0	0	0	0	0	1	2017	6
"NILL"	"NILL "	"PROPERTY THEFT"	"PAYNESVILLE"	"SOUL CLINIC COMMUNITY"	"6/8/2017"	"12:00 PM - 03:00 PM"	"WITHDRAWN"	"COMPLETED "	5014	"2017-06-08"	0	0	0	0	0	0	0	0	0	0	0	0	1	2017	6
"NILL"	"NILL "	"CRIMINAL MISCHIEF"	"PAYNESVILLE"	"SOUL CLINIC COMMUNITY"	"6/13/2017"	"06:00 PM - 09:00 PM"	"WITHDRAWN"	"COMPLETED "	5014	"2017-06-13"	0	0	0	0	0	0	0	0	0	0	0	0	1	2017	6
"NILL"	"NILL "	"PROPERTY THEFT"	"PAYNESVILLE"	"SOUL CLINIC COMMUNITY"	"6/14/2017"	"03:00 PM - 06:00 PM"	"PENDING"	"COMPLETED "	5014	"2017-06-14"	0	0	0	0	0	0	0	0	0	0	0	0	1	2017	6
"NILL"	"NIL"	"BURGLARY"	"CONGO TOWN"	"PEACE ISLAND COMMUNITY"	"6/10/2017"	"00:00 AM - 03:00 AM"	"PENDING"	"COMPLETED "	3000	"2017-06-10"	0	1	0	0	0	0	0	0	0	0	0	0	0	2017	6
"NILL"	"NIL"	"MANSLAUGHTER"	"BUSHROD ISLAND"	"DOE COMMUNITY"	"6/9/2017"	"09:00 AM - 12:00 PM"	"PENDING"	"COMPLETED "	10004	"2017-06-09"	0	0	0	0	0	0	0	0	0	0	0	0	1	2017	6
"NILL"	"NIL"	"ENDANGERING CHILD WELFEAR"	"CENTRAL MONROVIA"	"UN DRIVE COMMUNITY"	"6/2/2017"	"12:00 PM - 03:00 PM"	"WITHDRAWN"	"COMPLETED "	2001	"2017-06-02"	0	0	0	0	0	0	0	0	0	0	0	0	1	2017	6
"NILL"	"NIL"	"SIMPLE ASSAULT"	"CENTRAL MONROVIA"	"BASSA COMMUNITY"	"6/3/2017"	"12:00 PM - 03:00 PM"	"WITHDRAWN"	"COMPLETED "	2037	"2017-06-03"	0	0	0	1	0	0	0	0	0	0	0	0	0	2017	6
"NILL"	"NIL"	"RAPE"	"CENTRAL MONROVIA"	"UN DRIVE COMMUNITY"	"6/14/2017"	"12:00 PM - 03:00 PM"	"PENDING"	"COMPLETED "	2001	"2017-06-14"	0	0	0	0	1	0	0	0	0	0	0	0	0	2017	6
"NILL"	"NIL"	"RAPE"	"CENTRAL MONROVIA"	"UN DRIVE COMMUNITY"	"6/15/2017"	"09:00 AM - 12:00 PM"	"PENDING"	"COMPLETED "	2001	"2017-06-15"	0	0	0	0	1	0	0	0	0	0	0	0	0	2017	6
"NILL"	"NIL"	"CRIMINAL COERCION"	"BUSHROD ISLAND"	"DOE COMMUNITY"	"6/9/2017"	"09:00 AM - 12:00 PM"	"COURT"	"COMPLETED "	10004	"2017-06-09"	0	0	0	0	0	0	0	0	0	0	0	0	1	2017	6
"NILL"	"NIL"	"PROPERTY THEFT"	"BUSHROD ISLAND"	"DOE COMMUNITY"	"6/8/2017"	"03:00 PM - 06:00 PM"	"WITHDRAWN"	"COMPLETED "	10004	"2017-06-08"	0	0	0	0	0	0	0	0	0	0	0	0	1	2017	6
"NILL"	"NIL"	"AGGRAVATED ASSAULT"	"BUSHROD ISLAND"	"DOE COMMUNITY"	"6/18/2017"	"06:00 PM - 09:00 PM"	"PENDING"	"COMPLETED "	10004	"2017-06-18"	0	0	1	0	0	0	0	0	0	0	0	0	0	2017	6
"NILL"	"NIL"	"PROPERTY THEFT"	"BUSHROD ISLAND"	"DOE COMMUNITY"	"6/20/2017"	"03:00 PM - 06:00 PM"	"PENDING"	"COMPLETED "	10004	"2017-06-20"	0	0	0	0	0	0	0	0	0	0	0	0	1	2017	6
"NILL"	"NIL"	"AGGRAVATED ASSAULT"	"BUSHROD ISLAND"	"DOE COMMUNITY"	"6/22/2017"	"06:00 PM - 09:00 PM"	"PENDING"	"COMPLETED "	10004	"2017-06-22"	0	0	1	0	0	0	0	0	0	0	0	0	0	2017	6
"NIL"	"NIL"	"BURGLARY"	"BUSHROD ISLAND"	"NEW GEORGIA COMMUNITY"	"7/5/2017"	"12:00 PM - 03:00 PM"	"COURT"	"COMPLETED"	4020	"2017-07-05"	0	1	0	0	0	0	0	0	0	0	0	0	0	2017	7
"NIL"	"NIL"	"BURGLARY"	"BUSHROD ISLAND"	"LOUISANA COMMUNITY"	"7/4/2017"	"06:00 AM - 09:00 AM"	"WITHDRAWN"	"COMPLETED"	7002	"2017-07-04"	0	1	0	0	0	0	0	0	0	0	0	0	0	2017	7
"NIL"	"NIL"	"AGGRAVATED ASSAULT"	"BUSHROD ISLAND"	"NORTH ROAD COMMUNITY"	"7/15/2017"	"06:00 AM - 09:00 AM"	"COURT"	"COMPLETED"	7003	"2017-07-15"	0	0	1	0	0	0	0	0	0	0	0	0	0	2017	7
"NIL"	"NIL"	"MISAPPLICATION OF ENTRUSTED PROPERTY"	"PAYNESVILLE"	"GSA ROAD COMMUNITY"	"7/8/2017"	"09:00 AM - 12:00 PM"	"COURT"	"COMPLETED"	5002	"2017-07-08"	0	1	0	0	0	0	0	0	0	0	0	0	0	2017	7
"NIL"	"NIL"	"PROPERTY THEFT"	"PAYNESVILLE"	"MORRIS' FARM COMMUNITY"	"7/17/2017"	"09:00 AM - 12:00 PM"	"COURT"	"COMPLETED"	9021	"2017-07-17"	0	0	0	0	0	0	0	0	0	0	0	0	1	2017	7
"NIL"	"NIL"	"PROPERTY THEFT"	"PAYNESVILLE"	"SOUL CLINIC COMMUNITY"	"7/15/2017"	"12:00 PM - 03:00 PM"	"WITHDRAWN"	"COMPLETED"	5014	"2017-07-15"	0	0	0	0	0	0	0	0	0	0	0	0	1	2017	7
"NIL"	"NIL"	"PROPERTY THEFT"	"PAYNESVILLE"	"SOUL CLINIC COMMUNITY"	"7/9/2017"	"09:00 AM - 12:00 PM"	"COURT"	"COMPLETED"	5014	"2017-07-09"	0	0	0	0	0	0	0	0	0	0	0	0	1	2017	7
"NIL"	"NIL"	"PROPERTY THEFT"	"PAYNESVILLE"	"SOUL CLINIC COMMUNITY"	"7/10/2017"	"09:00 AM - 12:00 PM"	"COURT"	"COMPLETED"	5014	"2017-07-10"	0	0	0	0	0	0	0	0	0	0	0	0	1	2017	7
"NIL"	"NIL"	"BURGLARY"	"BUSHROD ISLAND"	"LOUISANA COMMUNITY"	"7/4/2017"	"06:00 AM - 09:00 AM"	"WITHDRAWN"	"COMPLETED"	7002	"2017-07-04"	0	1	0	0	0	0	0	0	0	0	0	0	0	2017	7
"NIL"	"NIL"	"PROPERTY THEFT"	"PAYNESVILLE"	"SOUL CLINIC COMMUNITY"	"7/3/2017"	"06:00 PM - 09:00 PM"	"WITHDRAWN"	"COMPLETED"	5014	"2017-07-03"	0	0	0	0	0	0	0	0	0	0	0	0	1	2017	7
"NIL"	"NIL"	"SIMPLE ASSAULT"	"PAYNESVILLE"	"SOUL CLINIC COMMUNITY"	"7/4/2017"	"09:00 AM - 12:00 PM"	"WITHDRAWN"	"COMPLETED"	5014	"2017-07-04"	0	0	0	1	0	0	0	0	0	0	0	0	0	2017	7
"NIL"	"NIL"	"SIMPLE ASSAULT"	"PAYNESVILLE"	"SOUL CLINIC COMMUNITY"	"7/9/2017"	"09:00 AM - 12:00 PM"	"WITHDRAWN"	"COMPLETED"	5014	"2017-07-09"	0	0	0	1	0	0	0	0	0	0	0	0	0	2017	7
"NIL"	"NIL"	"SIMPLE ASSAULT"	"PAYNESVILLE"	"SOUL CLINIC COMMUNITY"	"7/10/2017"	"09:00 AM - 12:00 PM"	"WITHDRAWN"	"COMPLETED"	5014	"2017-07-10"	0	0	0	1	0	0	0	0	0	0	0	0	0	2017	7
"NIL"	"NIL"	"PROPERTY THEFT"	"PAYNESVILLE"	"SOUL CLINIC COMMUNITY"	"6/3/2017"	"09:00 AM - 12:00 PM"	"PENDING"	"COMPLETED"	5014	"2017-06-03"	0	0	0	0	0	0	0	0	0	0	0	0	1	2017	6
"NIL"	"NIL"	"PROPERTY THEFT"	"PAYNESVILLE"	"SOUL CLINIC COMMUNITY"	"7/14/2017"	"06:00 AM - 09:00 AM"	"PENDING"	"COMPLETED"	5014	"2017-07-14"	0	0	0	0	0	0	0	0	0	0	0	0	1	2017	7
"NIL"	"NIL"	"PROPERTY THEFT"	"PAYNESVILLE"	"SOUL CLINIC COMMUNITY"	"7/14/2017"	"12:00 PM - 03:00 PM"	"PENDING"	"COMPLETED"	5014	"2017-07-14"	0	0	0	0	0	0	0	0	0	0	0	0	1	2017	7
"NIL"	"NIL"	"PROPERTY THEFT"	"PAYNESVILLE"	"SOUL CLINIC COMMUNITY"	"7/15/2017"	"03:00 PM - 06:00 PM"	"WITHDRAWN"	"COMPLETED"	5014	"2017-07-15"	0	0	0	0	0	0	0	0	0	0	0	0	1	2017	7
"NIL"	"NIL"	"PROPERTY THEFT"	"PAYNESVILLE"	"SOUL CLINIC COMMUNITY"	"7/15/2017"	"09:00 AM - 12:00 PM"	"PENDING"	"COMPLETED"	5014	"2017-07-15"	0	0	0	0	0	0	0	0	0	0	0	0	1	2017	7
"NIL"	"NIL"	"PROPERTY THEFT"	"PAYNESVILLE"	"SOUL CLINIC COMMUNITY"	"7/15/2017"	"09:00 AM - 12:00 PM"	"PENDING"	"COMPLETED"	5014	"2017-07-15"	0	0	0	0	0	0	0	0	0	0	0	0	1	2017	7
"NIL"	"NIL"	"PROPERTY THEFT"	"PAYNESVILLE"	"SOUL CLINIC COMMUNITY"	"7/17/2017"	"09:00 AM - 12:00 PM"	"PENDING"	"COMPLETED"	5014	"2017-07-17"	0	0	0	0	0	0	0	0	0	0	0	0	1	2017	7
"NIL"	"NIL"	"SIMPLE ASSAULT"	"PAYNESVILLE"	"ZUBAH TOWN COMMUNITY"	"7/8/2017"	"09:00 AM - 12:00 PM"	"WITHDRAWN"	"COMPLETED"	5008	"2017-07-08"	0	0	0	1	0	0	0	0	0	0	0	0	0	2017	7
"NIL"	"NIL"	"AGGRAVATED ASSAULT"	"CONGO TOWN"	"PEACE ISLAND COMMUNITY"	"7/2/2017"	"09:00 PM - 00:00 AM"	"PENDING"	"COMPLETED"	3000	"2017-07-02"	0	0	1	0	0	0	0	0	0	0	0	0	0	2017	7
"NIL"	"NIL"	"PROPERTY THEFT"	"SINKOR"	"TARR TOWN COMMUNITY"	"6/25/2017"	"00:00 AM - 03:00 AM"	"PENDING"	"COMPLETED"	3005	"2017-06-25"	0	0	0	0	0	0	0	0	0	0	0	0	1	2017	6
"NIL"	"NIL"	"CRIMINAL MISCHIEF"	"CONGO TOWN"	"PEACE ISLAND COMMUNITY"	"7/8/2017"	"12:00 PM - 03:00 PM"	"PENDING"	"COMPLETED"	3000	"2017-07-08"	0	0	0	0	0	0	0	0	0	0	0	0	1	2017	7
"NIL"	"NIL"	"BURGLARY"	"CONGO TOWN"	"PEACE ISLAND COMMUNITY"	"7/17/2017"	"12:00 PM - 03:00 PM"	"PENDING"	"COMPLETED"	3000	"2017-07-17"	0	1	0	0	0	0	0	0	0	0	0	0	0	2017	7
"NIL"	"NIL"	"MISAPPLICATION OF ENTRUSTED PROPERTY"	"CONGO TOWN"	"PEACE ISLAND COMMUNITY"	"7/17/2017"	"03:00 PM - 06:00 PM"	"PENDING"	"COMPLETED"	3000	"2017-07-17"	0	1	0	0	0	0	0	0	0	0	0	0	0	2017	7
"NIL"	"NIL"	"PROPERTY THEFT"	"PAYNESVILLE"	"NEEZOE COMMUNITY"	"6/24/2017"	"12:00 PM - 03:00 PM"	"WITHDRAWN"	"COMPLETED"	9018	"2017-06-24"	0	0	0	0	0	0	0	0	0	0	0	0	1	2017	6
"NIL"	"NIL"	"AGGRAVATED ASSAULT"	"PAYNESVILLE"	"PEACE ISLAND COMMUNITY"	"7/1/2017"	"12:00 PM - 03:00 PM"	"WITHDRAWN"	"COMPLETED"	9029	"2017-07-01"	0	0	1	0	0	0	0	0	0	0	0	0	0	2017	7
"NIL"	"NIL"	"PROPERTY THEFT"	"PAYNESVILLE"	"NEYKE TOWN COMMUNITY"	"7/5/2017"	"03:00 PM - 06:00 PM"	"WITHDRAWN"	"COMPLETED"	9028	"2017-07-05"	0	0	0	0	0	0	0	0	0	0	0	0	1	2017	7
"NIL"	"NIL"	"INTERFERING WITH CHILD WELFARE"	"PAYNESVILLE"	"NEEZOE COMMUNITY"	"7/5/2017"	"03:00 PM - 06:00 PM"	"PENDING"	"COMPLETED"	9018	"2017-07-05"	0	0	0	0	0	0	0	0	0	0	0	0	1	2017	7
"NIL"	"NIL"	"PROPERTY THEFT"	"PAYNESVILLE"	"72ND COMMUNITY"	"7/5/2017"	"09:00 PM - 00:00 AM"	"WITHDRAWN"	"COMPLETED"	9012	"2017-07-05"	0	0	0	0	0	0	0	0	0	0	0	0	1	2017	7
"NIL"	"NIL"	"ROBBERY"	"PAYNESVILLE"	"72ND COMMUNITY"	"7/6/2017"	"06:00 AM - 09:00 AM"	"WITHDRAWN"	"COMPLETED"	9012	"2017-07-06"	0	1	0	0	0	0	0	0	0	0	0	0	0	2017	7
"NIL"	"NIL"	"SIMPLE ASSAULT"	"PAYNESVILLE"	"NEEZOE COMMUNITY"	"7/7/2017"	"06:00 PM - 09:00 PM"	"WITHDRAWN"	"COMPLETED"	9018	"2017-07-07"	0	0	0	1	0	0	0	0	0	0	0	0	0	2017	7
"NIL"	"NIL"	"CRIMINAL MISCHIEF"	"PAYNESVILLE"	"REHAB COMMUNITY"	"6/29/2017"	"03:00 PM - 06:00 PM"	"COURT"	"COMPLETED"	8006	"2017-06-29"	0	0	0	0	0	0	0	0	0	0	0	0	1	2017	6
"NIL"	"NIL"	"SIMPLE ASSAULT"	"PAYNESVILLE"	"REHAB COMMUNITY"	"7/17/2017"	"12:00 PM - 03:00 PM"	"WITHDRAWN"	"COMPLETED"	8006	"2017-07-17"	0	0	0	1	0	0	0	0	0	0	0	0	0	2017	7
"NIL"	"NIL"	"SIMPLE ASSAULT"	"PAYNESVILLE"	"THINKERVILLAGE COMMUNITY"	"6/18/2017"	"09:00 AM - 12:00 PM"	"WITHDRAWN"	"COMPLETED"	8013	"2017-06-18"	0	0	0	1	0	0	0	0	0	0	0	0	0	2017	6
"NIL"	"NIL"	"AGGRAVATED ASSAULT"	"PAYNESVILLE"	"THINKERVILLAGE COMMUNITY"	"6/16/2017"	"12:00 PM - 03:00 PM"	"COURT"	"COMPLETED"	8013	"2017-06-16"	0	0	1	0	0	0	0	0	0	0	0	0	0	2017	6
"NIL"	"NIL"	"PROPERTY THEFT"	"PAYNESVILLE"	"THINKERVILLAGE COMMUNITY"	"6/30/2017"	"12:00 PM - 03:00 PM"	"WITHDRAWN"	"COMPLETED"	8013	"2017-06-30"	0	0	0	0	0	0	0	0	0	0	0	0	1	2017	6
"NIL"	"NIL"	"PROPERTY THEFT"	"PAYNESVILLE"	"THINKERVILLAGE COMMUNITY"	"7/1/2017"	"06:00 AM - 09:00 AM"	"WITHDRAWN"	"COMPLETED"	8013	"2017-07-01"	0	0	0	0	0	0	0	0	0	0	0	0	1	2017	7
"NIL"	"NIL"	"PROPERTY THEFT"	"PAYNESVILLE"	"THINKERVILLAGE COMMUNITY"	"7/1/2017"	"06:00 AM - 09:00 AM"	"WITHDRAWN"	"COMPLETED"	8013	"2017-07-01"	0	0	0	0	0	0	0	0	0	0	0	0	1	2017	7
"NIL"	"NIL"	"PROPERTY THEFT"	"PAYNESVILLE"	"THINKERVILLAGE COMMUNITY"	"7/1/2017"	"06:00 AM - 09:00 AM"	"WITHDRAWN"	"COMPLETED"	8013	"2017-07-01"	0	0	0	0	0	0	0	0	0	0	0	0	1	2017	7
"NIL"	"NIL"	"CRIMINAL COERCION"	"PAYNESVILLE"	"THINKERVILLAGE COMMUNITY"	"7/14/2017"	"03:00 PM - 06:00 PM"	"WITHDRAWN"	"COMPLETED"	8013	"2017-07-14"	0	0	0	0	0	0	0	0	0	0	0	0	1	2017	7
"NIL"	"NIL"	"AGGRAVATED ASSAULT"	"BUSHROD ISLAND"	"CLARA TOWN COMMUNITY"	"7/1/2017"	"12:00 PM - 03:00 PM"	"COURT"	"COMPLETED"	10002	"2017-07-01"	0	0	1	0	0	0	0	0	0	0	0	0	0	2017	7
"NIL"	"NIL"	"AGGRAVATED ASSAULT"	"BUSHROD ISLAND"	"CLARA TOWN COMMUNITY"	"7/2/2017"	"06:00 PM - 09:00 PM"	"COURT"	"COMPLETED"	10002	"2017-07-02"	0	0	1	0	0	0	0	0	0	0	0	0	0	2017	7
"NIL"	"NIL"	"CRIMINAL MISCHIEF"	"BUSHROD ISLAND"	"DOE COMMUNITY"	"7/3/2017"	"09:00 PM - 00:00 AM"	"WITHDRAWN"	"COMPLETED"	10004	"2017-07-03"	0	0	0	0	0	0	0	0	0	0	0	0	1	2017	7
"NIL"	"NIL"	"CRIMINAL MISCHIEF"	"BUSHROD ISLAND"	"DOE COMMUNITY"	"7/4/2017"	"09:00 PM - 00:00 AM"	"PENDING"	"COMPLETED"	10004	"2017-07-04"	0	0	0	0	0	0	0	0	0	0	0	0	1	2017	7
"NIL"	"NIL"	"SIMPLE ASSAULT"	"BUSHROD ISLAND"	"DOE COMMUNITY"	"7/5/2017"	"09:00 AM - 12:00 PM"	"COURT"	"COMPLETED"	10004	"2017-07-05"	0	0	0	1	0	0	0	0	0	0	0	0	0	2017	7
"NIL"	"NIL"	"SIMPLE ASSAULT"	"BUSHROD ISLAND"	"CLARA TOWN COMMUNITY"	"7/7/2017"	"06:00 AM - 09:00 AM"	"WITHDRAWN"	"COMPLETED"	10002	"2017-07-07"	0	0	0	1	0	0	0	0	0	0	0	0	0	2017	7
"NIL"	"NIL"	"AGGRAVATED ASSAULT"	"BUSHROD ISLAND"	"JAMAICA ROAD COMMUNITY"	"7/8/2017"	"12:00 PM - 03:00 PM"	"COURT"	"COMPLETED"	10020	"2017-07-08"	0	0	1	0	0	0	0	0	0	0	0	0	0	2017	7
"NIL"	"NIL"	"RAPE"	"BUSHROD ISLAND"	"CLARA TOWN COMMUNITY"	"7/9/2017"	"09:00 AM - 12:00 PM"	"COURT"	"COMPLETED"	10002	"2017-07-09"	0	0	0	0	1	0	0	0	0	0	0	0	0	2017	7
"NIL"	"NIL"	"SIMPLE ASSAULT"	"BUSHROD ISLAND"	"CLARA TOWN COMMUNITY"	"7/10/2017"	"09:00 AM - 12:00 PM"	"WITHDRAWN"	"COMPLETED"	10002	"2017-07-10"	0	0	0	1	0	0	0	0	0	0	0	0	0	2017	7
"NIL"	"NIL"	"PROPERTY THEFT"	"BUSHROD ISLAND"	"JAMAICA ROAD COMMUNITY"	"7/11/2017"	"09:00 AM - 12:00 PM"	"COURT"	"COMPLETED"	10020	"2017-07-11"	0	0	0	0	0	0	0	0	0	0	0	0	1	2017	7
"NIL"	"NIL"	"PROPERTY THEFT"	"BUSHROD ISLAND"	"JAMAICA ROAD COMMUNITY"	"7/12/2017"	"09:00 AM - 12:00 PM"	"COURT"	"COMPLETED"	10020	"2017-07-12"	0	0	0	0	0	0	0	0	0	0	0	0	1	2017	7
"NIL"	"NIL"	"PROPERTY THEFT"	"BUSHROD ISLAND"	"DOE COMMUNITY"	"7/14/2017"	"09:00 PM - 00:00 AM"	"COURT"	"COMPLETED"	10004	"2017-07-14"	0	0	0	0	0	0	0	0	0	0	0	0	1	2017	7
"NIL"	"NIL"	"PROPERTY THEFT"	"BUSHROD ISLAND"	"DOE COMMUNITY"	"7/15/2017"	"09:00 PM - 00:00 AM"	"PENDING"	"COMPLETED"	10004	"2017-07-15"	0	0	0	0	0	0	0	0	0	0	0	0	1	2017	7
"NIL"	"NIL"	"PROPERTY THEFT"	"BUSHROD ISLAND"	"DOE COMMUNITY"	"7/17/2017"	"09:00 AM - 12:00 PM"	"COURT"	"COMPLETED"	10004	"2017-07-17"	0	0	0	0	0	0	0	0	0	0	0	0	1	2017	7
"NIL"	"NIL"	"DISORDERLY CONDUCT"	"BUSHROD ISLAND"	"DOE COMMUNITY"	"7/21/2017"	"09:00 AM - 12:00 PM"	"WITHDRAWN"	"COMPLETED"	10004	"2017-07-21"	0	0	0	0	0	0	0	0	0	0	0	0	1	2017	7
"NIL"	"NIL"	"DISORDERLY CONDUCT"	"BUSHROD ISLAND"	"DOE COMMUNITY"	"7/22/2017"	"09:00 AM - 12:00 PM"	"WITHDRAWN"	"COMPLETED"	10004	"2017-07-22"	0	0	0	0	0	0	0	0	0	0	0	0	1	2017	7
"NIL"	"NIL"	"DISORDERLY CONDUCT"	"BUSHROD ISLAND"	"DOE COMMUNITY"	"7/23/2017"	"09:00 AM - 12:00 PM"	"WITHDRAWN"	"COMPLETED"	10004	"2017-07-23"	0	0	0	0	0	0	0	0	0	0	0	0	1	2017	7
"NIL"	"NIL"	"CRIMINAL MISCHIEF"	"BUSHROD ISLAND"	"CLARA TOWN COMMUNITY"	"7/2/2017"	"03:00 PM - 06:00 PM"	"PENDING"	"COMPLETED"	10002	"2017-07-02"	0	0	0	0	0	0	0	0	0	0	0	0	1	2017	7
"NIL"	"NIL"	"DISORDERLY CONDUCT"	"BUSHROD ISLAND"	"CLARA TOWN COMMUNITY"	"7/3/2017"	"06:00 PM - 09:00 PM"	"WITHDRAWN"	"COMPLETED"	10002	"2017-07-03"	0	0	0	0	0	0	0	0	0	0	0	0	1	2017	7
"NIL"	"NIL"	"DISORDERLY CONDUCT"	"BUSHROD ISLAND"	"CLARA TOWN COMMUNITY"	"7/4/2017"	"12:00 PM - 03:00 PM"	"WITHDRAWN"	"COMPLETED"	10002	"2017-07-04"	0	0	0	0	0	0	0	0	0	0	0	0	1	2017	7
"NIL"	"NIL"	"SIMPLE ASSAULT"	"BUSHROD ISLAND"	"JAMAICA ROAD COMMUNITY"	"7/5/2017"	"09:00 PM - 00:00 AM"	"WITHDRAWN"	"COMPLETED"	10020	"2017-07-05"	0	0	0	1	0	0	0	0	0	0	0	0	0	2017	7
"NIL"	"NIL"	"MISAPPLICATION OF ENTRUSTED PROPERTY"	"BUSHROD ISLAND"	"POINT FOUR COMMUNITY"	"7/3/2017"	"06:00 AM - 09:00 AM"	"COURT"	"COMPLETED"	1001	"2017-07-03"	0	1	0	0	0	0	0	0	0	0	0	0	0	2017	7
"NIL"	"NIL"	"HOMICIDE"	"SINKOR"	"PEACE ISLAND COMMUNITY"	"7/13/2017"	"03:00 AM - 06:00 AM"	"PENDING"	"COMPLETED"	3000	"2017-07-13"	0	0	0	0	0	0	0	0	0	0	0	1	0	2017	7
"NIL"	"NIL"	"RAPE"	"PAYNESVILLE"	"THINKERVILLAGE COMMUNITY"	"7/4/2017"	"06:00 AM - 09:00 AM"	"PENDING"	"COMPLETED"	8013	"2017-07-04"	0	0	0	0	1	0	0	0	0	0	0	0	0	2017	7
"NIL"	"NIL"	"SIMPLE ASSAULT"	"CENTRAL MONROVIA"	"UN DRIVE COMMUNITY"	"7/4/2017"	"09:00 AM - 12:00 PM"	"WITHDRAWN"	"COMPLETED"	2001	"2017-07-04"	0	0	0	1	0	0	0	0	0	0	0	0	0	2017	7
"NIL"	"NIL"	"DISORDERLY CONDUCT"	"CONGO TOWN"	"THUMBS UP COMMUNITY"	"7/5/2017"	"09:00 AM - 12:00 PM"	"WITHDRAWN"	"COMPLETED"	7007	"2017-07-05"	0	0	0	0	0	0	0	0	0	0	0	0	1	2017	7
"NIL"	"NIL"	"SIMPLE ASSAULT"	"BUSHROD ISLAND"	"LA-OY COMMUNITY"	"7/19/2017"	"03:00 PM - 06:00 PM"	"WITHDRAWN"	"COMPLETED"	7004	"2017-07-19"	0	0	0	1	0	0	0	0	0	0	0	0	0	2017	7
"NIL"	"NIL"	"PROPERTY THEFT"	"PAYNESVILLE"	"KPELLEH TOWN COMMUNITY"	"7/16/2017"	"NIL"	"WITHDRAWN"	"COMPLETED"	3019	"2017-07-16"	0	0	0	0	0	0	0	0	0	0	0	0	1	2017	7
"NIL"	"NIL"	"AGGRAVATED ASSAULT"	"BUSHROD ISLAND"	"CLARA TOWN COMMUNITY"	"7/1/2017"	"06:00 PM - 09:00 PM"	"WITHDRAWN"	"COMPLETED"	10002	"2017-07-01"	0	0	1	0	0	0	0	0	0	0	0	0	0	2017	7
"NIL"	"NIL"	"CRIMINAL MISCHIEF"	"BUSHROD ISLAND"	"CLARA TOWN COMMUNITY"	"7/3/2017"	"03:00 PM - 06:00 PM"	"PENDING"	"COMPLETED"	10002	"2017-07-03"	0	0	0	0	0	0	0	0	0	0	0	0	1	2017	7
"NIL"	"NIL"	"MISAPPLICATION OF ENTRUSTED PROPERTY"	"BUSHROD ISLAND"	"CLARA TOWN COMMUNITY"	"7/6/2017"	"12:00 PM - 03:00 PM"	"PENDING"	"COMPLETED"	10002	"2017-07-06"	0	1	0	0	0	0	0	0	0	0	0	0	0	2017	7
"KNIVES"	"NIL"	"ARMED ROBBERY"	"PAYNESVILLE"	"ROCK HILL COMMUNITY"	"6/20/2017"	"00:00 AM - 03:00 AM"	"COURT"	"COMPLETED"	2014	"2017-06-20"	1	0	0	0	0	0	0	0	0	0	0	0	0	2017	6
"SINGLE BARREL GUN"	"NIL"	"POSSESSION & SALE OF PHYSICAL OBJECTS FOR LETHAL USE"	"PAYNESVILLE"	"GSA ROAD COMMUNITY"	"7/10/2017"	"03:00 PM - 06:00 PM"	"COURT"	"COMPLETED"	5002	"2017-07-10"	0	0	0	0	0	0	0	0	0	0	0	0	1	2017	7
"SINGLE BARREL GUN"	"NIL"	"ARMED ROBBERY"	"PAYNESVILLE"	"SOUL CLINIC COMMUNITY"	"7/9/2017"	"03:00 AM - 06:00 AM"	"COURT"	"COMPLETED"	5014	"2017-07-09"	1	0	0	0	0	0	0	0	0	0	0	0	0	2017	7
"SINGLE BARREL GUN"	"NIL"	"ARMED ROBBERY"	"PAYNESVILLE"	"NEW HOPE COMMUNITY"	"7/25/2017"	"00:00 AM - 03:00 AM"	"PENDING"	"COMPLETED"	9003	"2017-07-25"	1	0	0	0	0	0	0	0	0	0	0	0	0	2017	7
"NIL"	"NIL"	"CRIMINAL MISCHIEF"	"PAYNESVILLE"	"72ND COMMUNITY"	"7/3/2017"	"09:00 AM - 12:00 PM"	"COURT"	"COMPLETED "	9012	"2017-07-03"	0	0	0	0	0	0	0	0	0	0	0	0	1	2017	7
"NIL"	"NIL"	"AGGRAVATED ASSAULT"	"PAYNESVILLE"	"PEACE ISLAND COMMUNITY"	"7/9/2017"	"06:00 PM - 09:00 PM"	"WITHDRAWN "	"COMPLETED "	9029	"2017-07-09"	0	0	1	0	0	0	0	0	0	0	0	0	0	2017	7
"NIL"	"NIL"	"SIMPLE ASSAULT"	"BUSHROD ISLAND"	"DOE COMMUNITY"	"7/14/2017"	"00:00 AM - 03:00 AM"	"WITHDRAWN "	"COMPLETED "	10004	"2017-07-14"	0	0	0	1	0	0	0	0	0	0	0	0	0	2017	7
"NIL"	"NIL"	"PROPERTY THEFT"	"BUSHROD ISLAND"	"CLARA TOWN COMMUNITY"	"7/4/2017"	"03:00 PM - 06:00 PM"	"WITHDRAWN "	"COMPLETED "	10002	"2017-07-04"	0	0	0	0	0	0	0	0	0	0	0	0	1	2017	7
"NIL"	"NIL"	"PROPERTY THEFT"	"BUSHROD ISLAND"	"DOE COMMUNITY"	"7/19/2017"	"09:00 PM - 00:00 AM"	"PENDING "	"COMPLETED "	10004	"2017-07-19"	0	0	0	0	0	0	0	0	0	0	0	0	1	2017	7
"NIL"	"NIL"	"BURGLARY"	"PAYNESVILLE"	"ZUBAH TOWN COMMUNITY"	"6/2/2017"	"00:00 AM - 03:00 AM"	"COURT"	"COMPLETED "	5008	"2017-06-02"	0	1	0	0	0	0	0	0	0	0	0	0	0	2017	6
"NIL"	"NIL"	"AGGRAVATED ASSAULT"	"PAYNESVILLE"	"ZUBAH TOWN COMMUNITY"	"6/23/2017"	"06:00 AM - 09:00 AM"	"COURT"	"COMPLETED "	5008	"2017-06-23"	0	0	1	0	0	0	0	0	0	0	0	0	0	2017	6
"NIL"	"NIL"	"MISAPPLICATION OF ENTRUSTED PROPERTY"	"PAYNESVILLE"	"GSA ROAD COMMUNITY"	"7/4/2017"	"06:00 AM - 09:00 AM"	"COURT"	"COMPLETED "	5002	"2017-07-04"	0	1	0	0	0	0	0	0	0	0	0	0	0	2017	7
"NIL"	"NIL"	"AGGRAVATED ASSAULT"	"BUSHROD ISLAND"	"POINT FOUR COMMUNITY"	"7/3/2017"	"12:00 PM - 03:00 PM"	"COURT"	"COMPLETED "	1001	"2017-07-03"	0	0	1	0	0	0	0	0	0	0	0	0	0	2017	7
"NIL"	"NIL"	"AGGRAVATED ASSAULT"	"BUSHROD ISLAND"	"POINT FOUR COMMUNITY"	"7/6/2017"	"06:00 PM - 09:00 PM"	"COURT"	"COMPLETED "	1001	"2017-07-06"	0	0	1	0	0	0	0	0	0	0	0	0	0	2017	7
"NIL"	"NIL"	"AGGRAVATED ASSAULT"	"PAYNESVILLE"	"ELWA COMMUNITY"	"6/12/2017"	"06:00 AM - 09:00 AM"	"COURT"	"COMPLETED "	8005	"2017-06-12"	0	0	1	0	0	0	0	0	0	0	0	0	0	2017	6
"NIL"	"NIL"	"PROPERTY THEFT"	"PAYNESVILLE"	"ELWA COMMUNITY"	"6/16/2017"	"06:00 PM - 09:00 PM"	"WITHDRAWN "	"COMPLETED "	8005	"2017-06-16"	0	0	0	0	0	0	0	0	0	0	0	0	1	2017	6
"NIL"	"NIL"	"PROPERTY THEFT"	"PAYNESVILLE"	"REHAB COMMUNITY"	"6/17/2017"	"09:00 AM - 12:00 PM"	"WITHDRAWN "	"COMPLETED "	8006	"2017-06-17"	0	0	0	0	0	0	0	0	0	0	0	0	1	2017	6
"NIL"	"NIL"	"PROPERTY THEFT"	"PAYNESVILLE"	"THINKER VILLAGE COMMUNITY"	"6/21/2017"	"09:00 AM - 12:00 PM"	"WITHDRAWN "	"COMPLETED "	8013	"2017-06-21"	0	0	0	0	0	0	0	0	0	0	0	0	1	2017	6
"NIL"	"NIL"	"PROPERTY THEFT"	"PAYNESVILLE"	"REHAB COMMUNITY"	"6/27/2017"	"09:00 AM - 12:00 PM"	"COURT"	"COMPLETED "	8006	"2017-06-27"	0	0	0	0	0	0	0	0	0	0	0	0	1	2017	6
"NIL"	"NIL"	"AGGRAVATED ASSAULT"	"PAYNESVILLE"	"ELWA COMMUNITY"	"7/13/2017"	"06:00 AM - 09:00 AM"	"COURT"	"COMPLETED "	8005	"2017-07-13"	0	0	1	0	0	0	0	0	0	0	0	0	0	2017	7
"NIL"	"NIL"	"PROPERTY THEFT"	"PAYNESVILLE"	"THINKER VILLAGE COMMUNITY"	"7/15/2017"	"NIL"	"PENDING "	"COMPLETED "	8013	"2017-07-15"	0	0	0	0	0	0	0	0	0	0	0	0	1	2017	7
"NIL"	"NIL"	"PROPERTY THEFT"	"CENTRAL MONROVIA"	"CARY STREET COMMUNITY"	"6/17/2017"	"06:00 PM - 09:00 PM"	"WITHDRAWN "	"COMPLETED "	2010	"2017-06-17"	0	0	0	0	0	0	0	0	0	0	0	0	1	2017	6
"NIL"	"NIL"	"AGGRAVATED ASSAULT"	"BUSHROD ISLAND"	"DUALA COMMUNITY"	"7/5/2017"	"06:00 PM - 09:00 PM"	"WITHDRAWN "	"COMPLETED "	1014	"2017-07-05"	0	0	1	0	0	0	0	0	0	0	0	0	0	2017	7
"NIL"	"NIL"	"SIMPLE ASSAULT"	"CENTRAL MONROVIA"	"ROCK TOWN COMMUNITY"	"6/26/2017"	"12:00 PM - 03:00 PM"	"WITHDRAWN "	"COMPLETED "	2001	"2017-06-26"	0	0	0	1	0	0	0	0	0	0	0	0	0	2017	6
"NIL"	"NIL"	"PROPERTY THEFT"	"CENTRAL MONROVIA"	"ROCK TOWN COMMUNITY"	"7/10/2017"	"03:00 PM - 06:00 PM"	"WITHDRAWN "	"COMPLETED "	2001	"2017-07-10"	0	0	0	0	0	0	0	0	0	0	0	0	1	2017	7
"NIL"	"NIL"	"PROPERTY THEFT"	"CENTRAL MONROVIA"	"CAREY STREET COMMUNITY"	"7/15/2017"	"09:00 AM - 12:00 PM"	"WITHDRAWN "	"COMPLETED "	2010	"2017-07-15"	0	0	0	0	0	0	0	0	0	0	0	0	1	2017	7
"NIL"	"NIL"	"PROPERTY THEFT"	"CENTRAL MONROVIA"	"UN DRIVE COMMUNITY"	"6/28/2017"	"06:00 PM - 09:00 PM"	"PENDING "	"COMPLETED "	2001	"2017-06-28"	0	0	0	0	0	0	0	0	0	0	0	0	1	2017	6
"NIL"	"NIL"	"PROPERTY THEFT"	"BUSHROD ISLAND"	"KPELLE TOWN COMMUNITY"	"6/27/2017"	"06:00 PM - 09:00 PM"	"WITHDRAWN "	"COMPLETED "	3019	"2017-06-27"	0	0	0	0	0	0	0	0	0	0	0	0	1	2017	6
"NIL"	"NIL"	"PROPERTY THEFT"	"BUSHROD ISLAND"	"CLARA TOWN COMMUNITY"	"7/17/2017"	"03:00 PM - 06:00 PM"	"PENDING "	"COMPLETED "	10002	"2017-07-17"	0	0	0	0	0	0	0	0	0	0	0	0	1	2017	7
"NIL"	"NIL"	"PROPERTY THEFT"	"PAYNESVILLE"	"PLANK FIELD COMMUNITY"	"7/2/2017"	"09:00 AM - 12:00 PM"	"WITHDRAWN "	"COMPLETED "	4024	"2017-07-02"	0	0	0	0	0	0	0	0	0	0	0	0	1	2017	7
"NIL"	"NIL"	"PROPERTY THEFT"	"PAYNESVILLE"	"72ND COMMUNITY"	"7/5/2017"	"06:00 AM - 09:00 AM"	"WITHDRAWN "	"COMPLETED "	9012	"2017-07-05"	0	0	0	0	0	0	0	0	0	0	0	0	1	2017	7
"NIL"	"NIL"	"PROPERTY THEFT"	"CENTRAL MONROVIA"	"BASSA TOWN COMMUNITY"	"                              7/23/2017     "	"03:00 PM - 06:00 PM"	"WITHDRAWN "	"COMPLETED "	10020	"2017-07-23"	0	0	0	0	0	0	0	0	0	0	0	0	1	2017	7
"NIL"	"NIL"	"SIMPLE ASSAULT"	"BUSHROD ISLAND"	"JAMAICA ROAD COMMUNITY"	"7/12/2017"	"12:00 PM - 03:00 PM"	"WITHDRAWN "	"COMPLETED "	10020	"2017-07-12"	0	0	0	1	0	0	0	0	0	0	0	0	0	2017	7
"NIL"	"NIL"	"PROPERTY THEFT"	"BUSHROD ISLAND"	"JAMAICA ROAD COMMUNITY"	"7/15/2017"	"06:00 PM - 09:00 PM"	"WITHDRAWN "	"COMPLETED "	10020	"2017-07-15"	0	0	0	0	0	0	0	0	0	0	0	0	1	2017	7
"NIL"	"NIL"	"PROPERTY THEFT"	"BUSHROD ISLAND"	"JAMAICA ROAD COMMUNITY"	"7/17/2017"	"12:00 PM - 03:00 PM"	"COURT"	"COMPLETED "	10020	"2017-07-17"	0	0	0	0	0	0	0	0	0	0	0	0	1	2017	7
"NIL"	"NIL"	"AUTO THEFT"	"CENTRAL MONROVIA"	"CAREY & NEWPORT STREET COMMUNITIES"	"7/3/2017"	"12:00 PM - 03:00 PM"	"PENDING "	"COMPLETED "	2010	"2017-07-03"	0	1	0	0	0	0	0	0	0	0	0	0	0	2017	7
"NIL"	"NIL"	"MISAPPLICATION OF ENTRUSTED PROPERTY"	"BUSHROD ISLAND"	"NEW GEORGIA "	"7/30/2017"	"09:00 AM - 12:00 PM "	"COURT "	"COMPLETED"	4020	"2017-07-30"	0	1	0	0	0	0	0	0	0	0	0	0	0	2017	7
"NIL"	"NIL"	"BURGLARY"	"BUSHROD ISLAND"	"NEW GEORGIA "	"8/4/2017"	"12:00 PM - 03:00 PM"	"WITHDRAWN"	"COMPLETED"	4020	"2017-08-04"	0	1	0	0	0	0	0	0	0	0	0	0	0	2017	8
"NIL"	"NIL"	"ROBBERY"	"BUSHROD ISLAND"	"NEW GEORGIA "	"7/28/2017"	"09:00 PM - 00:00 AM"	"COURT "	"COMPLETED"	4020	"2017-07-28"	0	1	0	0	0	0	0	0	0	0	0	0	0	2017	7
"NIL"	"NIL"	"ROBBERY"	"BUSHROD ISLAND"	"NEW GEORGIA "	"7/28/2017"	"09:00 PM - 00:00 AM"	"COURT "	"COMPLETED"	4020	"2017-07-28"	0	1	0	0	0	0	0	0	0	0	0	0	0	2017	7
"NIL"	"NIL"	"ROBBERY"	"BUSHROD ISLAND"	"NEW GEORGIA "	"7/28/2017"	"09:00 PM - 00:00 AM"	"COURT "	"COMPLETED"	4020	"2017-07-28"	0	1	0	0	0	0	0	0	0	0	0	0	0	2017	7
"NIL"	"NIL"	"MISAPPLICATION OF ENTRUSTED PROPERTY"	"BUSHROD ISLAND"	"NEW GEORGIA "	"8/2/2017"	"NIL"	"COURT "	"COMPLETED"	4020	"2017-08-02"	0	1	0	0	0	0	0	0	0	0	0	0	0	2017	8
"NIL"	"NIL"	"MISAPPLICATION OF ENTRUSTED PROPERTY"	"BUSHROD ISLAND"	"NEW GEORGIA "	"8/2/2017"	"NIL"	"COURT "	"COMPLETED"	4020	"2017-08-02"	0	1	0	0	0	0	0	0	0	0	0	0	0	2017	8
"NIL"	"NIL"	"MISAPPLICATION OF ENTRUSTED PROPERTY"	"BUSHROD ISLAND"	"NEW GEORGIA "	"8/2/2017"	"NIL"	"COURT "	"COMPLETED"	4020	"2017-08-02"	0	1	0	0	0	0	0	0	0	0	0	0	0	2017	8
"NIL"	"NIL"	"AUTO BOOSTING"	"BUSHROD ISLAND"	"NORTH ROAD COMMUNITY"	"8/3/2017"	"06:00 AM - 09:00 AM"	"PENDING "	"COMPLETED"	7003	"2017-08-03"	0	1	0	0	0	0	0	0	0	0	0	0	0	2017	8
"NIL"	"NIL"	"MENACING"	"BUSHROD ISLAND"	"LOUISSIANA COMMUNITY"	"8/12/2017"	"12:00 PM - 03:00 PM"	"COURT "	"COMPLETED"	7002	"2017-08-12"	0	0	0	0	0	0	0	0	0	0	0	0	1	2017	8
"NIL"	"NIL"	"BURGLARY"	"BUSHROD ISLAND"	"PEACE COMMUNITY"	"8/13/2017"	"06:00 AM - 09:00 AM"	"PENDING "	"COMPLETED"	7011	"2017-08-13"	0	1	0	0	0	0	0	0	0	0	0	0	0	2017	8
"NIL"	"NIL"	"PROPERTY THEFT"	"PAYNESVILLE"	"POLICE ACADEMY"	"7/21/2017"	"00:00 AM - 03:00 AM"	"COURT "	"COMPLETED"	5010	"2017-07-21"	0	0	0	0	0	0	0	0	0	0	0	0	1	2017	7
"NIL"	"NIL"	"ARMED ROBBERY"	"PAYNESVILLE"	"SOUL CLINIC COMMUNITY"	"7/9/2017"	"03:00 PM - 06:00 PM"	"PENDING "	"COMPLETED"	5014	"2017-07-09"	1	0	0	0	0	0	0	0	0	0	0	0	0	2017	7
"NIL"	"NIL"	"AGGRAVATED ASSAULT"	"PAYNESVILLE"	"ZUBAH TOWN COMMUNITY"	"7/26/2017"	"03:00 PM - 06:00 PM"	"WITHDRAWN"	"COMPLETED"	5008	"2017-07-26"	0	0	1	0	0	0	0	0	0	0	0	0	0	2017	7
"NIL"	"NIL"	"PROPERTY THEFT"	"BUSHROD ISLAND"	"DOE COMMUNITY"	"8/11/2017"	"12:00 PM - 03:00 PM"	"COURT "	"COMPLETED"	10004	"2017-08-11"	0	0	0	0	0	0	0	0	0	0	0	0	1	2017	8
"NIL"	"NIL"	"PROPERTY THEFT"	"BUSHROD ISLAND"	"BERNESVILLE COMMUNITY"	"8/2/2017"	"09:00 AM - 12:00 PM "	"COURT "	"COMPLETED"	4003	"2017-08-02"	0	0	0	0	0	0	0	0	0	0	0	0	1	2017	8
"NIL"	"NIL"	"ILLEGAL POSSESSION OF DRUGS"	"PAYNESVILLE"	"ELWA JUNCTION COMMUNITY"	"7/13/2017"	"06:00 AM - 09:00 AM"	"COURT "	"COMPLETED"	8005	"2017-07-13"	0	0	0	0	0	0	0	0	0	0	0	0	1	2017	7
"NIL"	"NIL"	"ROBBERY"	"PAYNESVILLE"	"REHAB COMMUNITY"	"6/14/2017"	"06:00 PM - 09:00 PM"	"COURT "	"COMPLETED"	8006	"2017-06-14"	0	1	0	0	0	0	0	0	0	0	0	0	0	2017	6
"NIL"	"NIL"	"PROPERTY THEFT"	"PAYNESVILLE"	"ELWA  COMMUNITY"	"7/20/2017"	"12:00 PM - 03:00 PM"	"COURT "	"COMPLETED"	8005	"2017-07-20"	0	0	0	0	0	0	0	0	0	0	0	0	1	2017	7
"NIL"	"NIL"	"PROPERTY THEFT"	"PAYNESVILLE"	"THINKER VILLAGE"	"7/20/2017"	"03:00 PM - 06:00 PM"	"COURT "	"COMPLETED"	8013	"2017-07-20"	0	0	0	0	0	0	0	0	0	0	0	0	1	2017	7
"NIL"	"NIL"	"AGGRAVATED ASSAULT"	"PAYNESVILLE"	"THINKER VILLAGE"	"6/27/2017"	"09:00 AM - 12:00 PM "	"COURT "	"COMPLETED"	8013	"2017-06-27"	0	0	1	0	0	0	0	0	0	0	0	0	0	2017	6
"NIL"	"NIL"	"BURGLARY"	"PAYNESVILLE"	"THINKER VILLAGE"	"8/6/2017"	"09:00 AM - 12:00 PM "	"WITHDRAWN"	"COMPLETED"	8013	"2017-08-06"	0	1	0	0	0	0	0	0	0	0	0	0	0	2017	8
"NIL"	"NIL"	"TERRORISTIC THREAT"	"PAYNESVILLE"	"ELWA COMMUNITY"	"8/11/2017"	"09:00 AM - 12:00 PM "	"COURT "	"COMPLETED"	8005	"2017-08-11"	0	0	0	0	0	0	0	0	0	0	0	0	1	2017	8
"NIL"	"NIL"	"AGGRAVATED ASSAULT"	"CENTRAL MONROVIA"	"PHP COMMUNITY"	"7/23/2017"	"00:00 AM - 03:00 AM"	"WITHDRAWN"	"COMPLETED"	2004	"2017-07-23"	0	0	1	0	0	0	0	0	0	0	0	0	0	2017	7
"NIL"	"NIL"	"SIMPLE ASSAULT"	"CENTRAL MONROVIA"	"MECHLIN STREET COMMUNITY"	"8/10/2017"	"03:00 PM - 06:00 PM"	"WITHDRAWN"	"COMPLETED"	2005	"2017-08-10"	0	0	0	1	0	0	0	0	0	0	0	0	0	2017	8
"NIL"	"NIL"	"PROPERTY THEFT"	"BUSHROD ISLAND"	"DOE COMMUNITY"	"8/1/2017"	"00:00 AM - 03:00 AM"	"COURT "	"COMPLETED"	10004	"2017-08-01"	0	0	0	0	0	0	0	0	0	0	0	0	1	2017	8
"NIL"	"NIL"	"AGGRAVATED ASSAULT"	"BUSHROD ISLAND"	"DOE COMMUNITY"	"8/2/2017"	"06:00 AM - 09:00 AM"	"COURT "	"COMPLETED"	10004	"2017-08-02"	0	0	1	0	0	0	0	0	0	0	0	0	0	2017	8
"NIL"	"NIL"	"PROPERTY THEFT"	"BUSHROD ISLAND"	"CLARA TOWN COMMUNITY"	"8/3/2017"	"12:00 PM - 03:00 PM"	"COURT "	"COMPLETED"	10002	"2017-08-03"	0	0	0	0	0	0	0	0	0	0	0	0	1	2017	8
"NIL"	"NIL"	"PROPERTY THEFT"	"BUSHROD ISLAND"	"DOE COMMUNITY"	"8/5/2017"	"12:00 PM - 03:00 PM"	"COURT "	"COMPLETED"	10004	"2017-08-05"	0	0	0	0	0	0	0	0	0	0	0	0	1	2017	8
"NIL"	"NIL"	"SIMPLE ASSAULT"	"BUSHROD ISLAND"	"DOE COMMUNITY"	"8/6/2017"	"09:00 AM - 12:00 PM "	"WITHDRAWN"	"COMPLETED"	10004	"2017-08-06"	0	0	0	1	0	0	0	0	0	0	0	0	0	2017	8
"NIL"	"NIL"	"SIMPLE ASSAULT"	"BUSHROD ISLAND"	"DOE COMMUNITY"	"8/8/2017"	"06:00 AM - 09:00 AM"	"WITHDRAWN"	"COMPLETED"	10004	"2017-08-08"	0	0	0	1	0	0	0	0	0	0	0	0	0	2017	8
"NIL"	"NIL"	"AGGRAVATED ASSAULT"	"BUSHROD ISLAND"	"DOE COMMUNITY"	"8/9/2017"	"09:00 AM - 12:00 PM "	"COURT "	"COMPLETED"	10004	"2017-08-09"	0	0	1	0	0	0	0	0	0	0	0	0	0	2017	8
"NIL"	"NIL"	"PROPERTY THEFT"	"BUSHROD ISLAND"	"DOE COMMUNITY"	"8/11/2017"	"03:00 PM - 06:00 PM"	"COURT "	"COMPLETED"	10004	"2017-08-11"	0	0	0	0	0	0	0	0	0	0	0	0	1	2017	8
"NIL"	"NIL"	"PROPERTY THEFT"	"BUSHROD ISLAND"	"DOE COMMUNITY"	"8/12/2017"	"12:00 PM - 03:00 PM"	"WITHDRAWN"	"COMPLETED"	10004	"2017-08-12"	0	0	0	0	0	0	0	0	0	0	0	0	1	2017	8
"NIL"	"NIL"	"SIMPLE ASSAULT"	"BUSHROD ISLAND"	"CLARA TOWN COMMUNITY"	"8/13/2017"	"12:00 PM - 03:00 PM"	"WITHDRAWN"	"COMPLETED"	10002	"2017-08-13"	0	0	0	1	0	0	0	0	0	0	0	0	0	2017	8
"NIL"	"NIL"	"AGGRAVATED ASSAULT"	"BUSHROD ISLAND"	"CLARA TOWN COMMUNITY"	"8/15/2017"	"12:00 PM - 03:00 PM"	"COURT "	"COMPLETED"	10002	"2017-08-15"	0	0	1	0	0	0	0	0	0	0	0	0	0	2017	8
"NIL"	"NIL"	"SIMPLE ASSAULT"	"BUSHROD ISLAND"	"DOE COMMUNITY"	"8/16/2017"	"12:00 PM - 03:00 PM"	"WITHDRAWN"	"COMPLETED"	10004	"2017-08-16"	0	0	0	1	0	0	0	0	0	0	0	0	0	2017	8
"NIL"	"NIL"	"DISORDERLY CONDUCT"	"BUSHROD ISLAND"	"DOE COMMUNITY"	"8/18/2017"	"12:00 PM - 03:00 PM"	"WITHDRAWN"	"COMPLETED"	10004	"2017-08-18"	0	0	0	0	0	0	0	0	0	0	0	0	1	2017	8
"NIL"	"NIL"	"DISORDERLY CONDUCT"	"BUSHROD ISLAND"	"DOE COMMUNITY"	"8/19/2017"	"12:00 PM - 03:00 PM"	"WITHDRAWN"	"COMPLETED"	10004	"2017-08-19"	0	0	0	0	0	0	0	0	0	0	0	0	1	2017	8
"NIL"	"NIL"	"PROPERTY THEFT"	"BUSHROD ISLAND"	"DOE COMMUNITY"	"8/20/2017"	"09:00 AM - 12:00 PM "	"PENDING "	"COMPLETED"	10004	"2017-08-20"	0	0	0	0	0	0	0	0	0	0	0	0	1	2017	8
"NIL"	"NIL"	"BURGLARY"	"BUSHROD ISLAND"	"DOE COMMUNITY"	"8/2/2017"	"09:00 AM - 12:00 PM "	"PENDING "	"COMPLETED"	10004	"2017-08-02"	0	1	0	0	0	0	0	0	0	0	0	0	0	2017	8
"NIL"	"NIL"	"DISORDERLY CONDUCT"	"BUSHROD ISLAND"	"DOE COMMUNITY"	"8/22/2017"	"12:00 PM - 03:00 PM"	"PENDING "	"COMPLETED"	10004	"2017-08-22"	0	0	0	0	0	0	0	0	0	0	0	0	1	2017	8
"NIL"	"NIL"	"CRIMINAL MISCHIEF"	"SINKOR"	"CATHOLIC JUNCTION COMMUNITY"	"8/7/2017"	"09:00 AM - 12:00 PM "	"COURT "	"COMPLETED"	3001	"2017-08-07"	0	0	0	0	0	0	0	0	0	0	0	0	1	2017	8
"NIL"	"NIL"	"DISORDERLY CONDUCT"	"SINKOR"	"CATHOLIC JUNCTION COMMUNITY"	"8/7/2017"	"09:00 AM - 12:00 PM "	"COURT "	"COMPLETED"	3001	"2017-08-07"	0	0	0	0	0	0	0	0	0	0	0	0	1	2017	8
"NIL"	"NIL"	"PROPERTY THEFT"	"CONGO TOWN"	"PEACE ISLAND COMMUNITY"	"8/10/2017"	"12:00 PM - 03:00 PM"	"PENDING "	"COMPLETED"	3000	"2017-08-10"	0	0	0	0	0	0	0	0	0	0	0	0	1	2017	8
"NIL"	"NIL"	"MENACING"	"SINKOR"	"CABRAL ESTATE COMMUNITY"	"8/15/2017"	"03:00 PM - 06:00 PM"	"COURT "	"COMPLETED"	3009	"2017-08-15"	0	0	0	0	0	0	0	0	0	0	0	0	1	2017	8
"NIL"	"NIL"	"MISAPPLICATION OF ENTRUSTED PROPERTY"	"SINKOR"	"GAYE TOWN COMMUNITY"	"7/18/2017"	"03:00 PM - 06:00 PM"	"WITHDRAWN"	"COMPLETED"	3012	"2017-07-18"	0	1	0	0	0	0	0	0	0	0	0	0	0	2017	7
"NIL"	"NIL"	"SIMPLE ASSAULT"	"SINKOR"	"VAI TOWN COMMUNITY"	"7/20/2017"	"00:00 AM - 03:00 AM"	"WITHDRAWN"	"COMPLETED"	3021	"2017-07-20"	0	0	0	1	0	0	0	0	0	0	0	0	0	2017	7
"NIL"	"NIL"	"SIMPLE ASSAULT"	"SINKOR"	"JOE BAR COMMUNITY"	"7/22/2017"	"12:00 PM - 03:00 PM"	"WITHDRAWN"	"COMPLETED"	5000	"2017-07-22"	0	0	0	1	0	0	0	0	0	0	0	0	0	2017	7
"NIL"	"NIL"	"CRIMINAL MISCHIEF"	"SINKOR"	"GAYE TOWN COMMUNITY"	"8/1/2017"	"06:00 AM - 09:00 AM"	"WITHDRAWN"	"COMPLETED"	3012	"2017-08-01"	0	0	0	0	0	0	0	0	0	0	0	0	1	2017	8
"NIL"	"NIL"	"DISORDERLY CONDUCT"	"SINKOR"	"SMALL TOWN COMMUNITY"	"8/6/2017"	"03:00 AM - 06:00 AM"	"WITHDRAWN"	"COMPLETED"	3027	"2017-08-06"	0	0	0	0	0	0	0	0	0	0	0	0	1	2017	8
"NIL"	"NIL"	"AGGRAVATED ASSAULT"	"PAYNESVILLE"	"72ND COMMUNITY"	"7/27/2017"	"12:00 PM - 03:00 PM"	"WITHDRAWN"	"COMPLETED"	9012	"2017-07-27"	0	0	1	0	0	0	0	0	0	0	0	0	0	2017	7
"NIL"	"NIL"	"AGGRAVATED ASSAULT"	"PAYNESVILLE"	"NEEZOE COMMUNITY"	"8/3/2017"	"09:00 AM - 12:00 PM "	"PENDING "	"COMPLETED"	9018	"2017-08-03"	0	0	1	0	0	0	0	0	0	0	0	0	0	2017	8
"NIL"	"NIL"	"PROPERTY THEFT"	"PAYNESVILLE"	"72ND COMMUNITY"	"8/5/2017"	"06:00 AM - 09:00 AM"	"WITHDRAWN"	"COMPLETED"	9012	"2017-08-05"	0	0	0	0	0	0	0	0	0	0	0	0	1	2017	8
"NIL"	"NIL"	"PROPERTY THEFT"	"PAYNESVILLE"	"72ND COMMUNITY"	"8/9/2017"	"09:00 PM - 00:00 AM"	"COURT "	"COMPLETED"	9012	"2017-08-09"	0	0	0	0	0	0	0	0	0	0	0	0	1	2017	8
"NIL"	"NIL"	"PROPERTY THEFT"	"PAYNESVILLE"	"72ND COMMUNITY"	"8/12/2017"	"09:00 AM - 12:00 PM "	"WITHDRAWN"	"COMPLETED"	9012	"2017-08-12"	0	0	0	0	0	0	0	0	0	0	0	0	1	2017	8
"NIL"	"NIL"	"CRIMINAL MISCHIEF"	"BUSHROD ISLAND"	"BONG MINE ROAD COMMUNITY"	"8/7/2017"	"09:00 AM - 12:00 PM "	"WITHDRAWN"	"COMPLETED"	1002	"2017-08-07"	0	0	0	0	0	0	0	0	0	0	0	0	1	2017	8
"NIL"	"NIL"	"PROPERTY THEFT"	"BUSHROD ISLAND"	"JAMAICA ROAD COMMUNITY"	"8/19/2017"	"09:00 PM - 00:00 AM"	"COURT "	"COMPLETED"	10020	"2017-08-19"	0	0	0	0	0	0	0	0	0	0	0	0	1	2017	8
"NIL"	"NIL"	"PROPERTY THEFT"	"PAYNESVILLE"	"BASSA TOWN COMMUNITY"	"7/19/2017"	"09:00 AM - 12:00 PM "	"COURT "	"COMPLETED"	10020	"2017-07-19"	0	0	0	0	0	0	0	0	0	0	0	0	1	2017	7
"NIL"	"NIL"	"PROPERTY THEFT"	"PAYNESVILLE"	"BASSA TOWN COMMUNITY"	"7/29/2017"	"09:00 AM - 12:00 PM "	"PENDING "	"COMPLETED"	10020	"2017-07-29"	0	0	0	0	0	0	0	0	0	0	0	0	1	2017	7
"NIL"	"NIL"	"MISAPPLICATION OF ENTRUSTED PROPERTY"	"PAYNESVILLE"	"72ND COMMUNITY"	"7/30/2017"	"09:00 AM - 12:00 PM "	"WITHDRAWN"	"COMPLETED"	9012	"2017-07-30"	0	1	0	0	0	0	0	0	0	0	0	0	0	2017	7
"NIL"	"NIL"	"PROPERTY THEFT"	"BUSHROD ISLAND"	"JAMAICA ROAD COMMUNITY"	"8/1/2017"	"09:00 AM - 12:00 PM "	"WITHDRAWN"	"COMPLETED"	10020	"2017-08-01"	0	0	0	0	0	0	0	0	0	0	0	0	1	2017	8
"NIL"	"NIL"	"PROPERTY THEFT"	"BUSHROD ISLAND"	"JAMAICA ROAD COMMUNITY"	"8/3/2017"	"12:00 PM - 03:00 PM"	"PENDING "	"COMPLETED"	10020	"2017-08-03"	0	0	0	0	0	0	0	0	0	0	0	0	1	2017	8
"NIL"	"NIL"	"PROPERTY THEFT"	"BUSHROD ISLAND"	"JAMAICA ROAD COMMUNITY"	"8/4/2017"	"09:00 AM - 12:00 PM "	"PENDING "	"COMPLETED"	10020	"2017-08-04"	0	0	0	0	0	0	0	0	0	0	0	0	1	2017	8
"NIL"	"NIL"	"BURGLARY"	"BUSHROD ISLAND"	"JAMAICA ROAD COMMUNITY"	"8/8/2017"	"03:00 PM - 06:00 PM"	"PENDING "	"COMPLETED"	10020	"2017-08-08"	0	1	0	0	0	0	0	0	0	0	0	0	0	2017	8
"NIL"	"NIL"	"SIMPLE ASSAULT"	"BUSHROD ISLAND"	"JAMAICA ROAD COMMUNITY"	"8/11/2017"	"09:00 AM - 12:00 PM "	"COURT "	"COMPLETED"	10020	"2017-08-11"	0	0	0	1	0	0	0	0	0	0	0	0	0	2017	8
"NIL"	"NIL"	"BURGLARY"	"BUSHROD ISLAND"	"PEACE ISLAND COMMUNITY"	"8/13/2017"	"03:00 PM - 06:00 PM"	"PENDING "	"COMPLETED"	7011	"2017-08-13"	0	1	0	0	0	0	0	0	0	0	0	0	0	2017	8
"NIL"	"NIL"	"CRIMINAL MISCHIEF"	"BUSHROD ISLAND"	"CLARA TOWN COMMUNITY"	"8/17/2017"	"03:00 PM - 06:00 PM"	"WITHDRAWN"	"COMPLETED"	10002	"2017-08-17"	0	0	0	0	0	0	0	0	0	0	0	0	1	2017	8
"NIL"	"NIL"	"PROPERTY THEFT"	"BREWERVILLE"	"BABYMA COMMUNITY"	"8/14/2017"	"06:00 AM - 09:00 AM"	"WITHDRAWN"	"COMPLETED"	6003	"2017-08-14"	0	0	0	0	0	0	0	0	0	0	0	0	1	2017	8
"KNIVES"	"NIL"	"ARMED ROBBERY"	"CENTRAL MONROVIA"	"UN DRIVE COMMUNITY"	"8/2/2017"	"09:00 PM - 00:00 AM"	"PENDING "	"COMPLETED"	2001	"2017-08-02"	1	0	0	0	0	0	0	0	0	0	0	0	0	2017	8
"NIL"	"NIL"	"RAPE"	"PAYNESVILLE"	"72ND COMMUNITY"	"8/10/2017"	"09:00 AM - 12:00 PM "	"PENDING "	"COMPLETED"	9012	"2017-08-10"	0	0	0	0	1	0	0	0	0	0	0	0	0	2017	8
"NIL"	"NIL"	"SEXUAL ASSAULT"	"PAYNESVILLE"	"JOE BAR COMMUNITY"	"8/1/2017"	"06:00 PM - 09:00 PM"	"PENDING "	"COMPLETED"	5000	"2017-08-01"	0	0	0	0	1	0	0	0	0	0	0	0	0	2017	8
"NIL"	"NIL"	"CORRUPTION OF MINOR"	"PAYNESVILLE"	"PARKER PAINT COMMUNITY"	"8/2/2017"	"06:00 PM - 09:00 PM"	"PENDING "	"COMPLETED"	5013	"2017-08-02"	0	0	0	0	0	0	0	0	0	0	0	0	1	2017	8
"NIL"	"NIL"	"CORRUPTION OF MINOR"	"PAYNESVILLE"	"VOKAR MISSION COMMUNITY"	"8/10/2017"	"09:00 PM - 00:00 AM"	"PENDING "	"COMPLETED"	5015	"2017-08-10"	0	0	0	0	0	0	0	0	0	0	0	0	1	2017	8
"NIL"	"NIL"	"GANG RAPE"	"PAYNESVILLE"	"JOE BAR COMMUNITY"	"8/14/2017"	"09:00 PM - 00:00 AM"	"COURT "	"COMPLETED"	5000	"2017-08-14"	0	0	0	0	1	0	0	0	0	0	0	0	0	2017	8
"NIL"	"NIL"	"RAPE"	"PAYNESVILLE"	"GSA ROAD COMMUNITY"	"8/14/2017"	"06:00 PM - 09:00 PM"	"PENDING "	"COMPLETED"	5002	"2017-08-14"	0	0	0	0	1	0	0	0	0	0	0	0	0	2017	8
"NIL"	"NIL"	"DISORDERLY CONDUCT"	"PAYNESVILLE"	"GSA ROAD COMMUNITY"	"8/16/2017"	"06:00 AM - 09:00 AM"	"WITHDRAWN"	"COMPLETED"	5002	"2017-08-16"	0	0	0	0	0	0	0	0	0	0	0	0	1	2017	8
"NIL"	"NIL"	"RAPE"	"PAYNESVILLE"	"POLICE ACADEMY COMMUNITY"	"8/1/2017"	"03:00 PM - 06:00 PM"	"PENDING "	"COMPLETED"	5010	"2017-08-01"	0	0	0	0	1	0	0	0	0	0	0	0	0	2017	8
"NIL"	"NIL"	"MENACING"	"BREWERVILLE"	"PERRY TOWN COMMUNITY"	"8/22/2017"	"09:00 AM - 12:00 PM "	"COURT "	"COMPLETED"	6011	"2017-08-22"	0	0	0	0	0	0	0	0	0	0	0	0	1	2017	8
"NIL"	"NIL"	"PROPERTY THEFT"	"BUSHROD ISLAND"	"CLARA TOWN COMMUNITY"	"8/8/2017"	"03:00 PM - 06:00 PM"	"COURT "	"COMPLETED"	10002	"2017-08-08"	0	0	0	0	0	0	0	0	0	0	0	0	1	2017	8
"NIL"	"NIL"	"RAPE"	"CENTRAL MONROVIA"	"BASSA COMMUNITY"	"8/1/2017"	"12:00 PM - 03:00 PM"	"PENDING "	"COMPLETED"	2037	"2017-08-01"	0	0	0	0	1	0	0	0	0	0	0	0	0	2017	8
"NIL"	"NIL"	"HUMAN TRAFFICKING"	"PAYNESVILLE"	"SOUL CLINIC COMMUNITY"	"8/13/2017"	"09:00 AM - 12:00 PM "	"PENDING "	"COMPLETED"	5014	"2017-08-13"	0	0	0	0	0	0	0	0	0	0	0	0	1	2017	8
"NIL"	"NIL"	"RAPE"	"CENTRAL MONROVIA"	"BASSA COMMUNITY"	"8/14/2017"	"12:00 PM - 03:00 PM"	"PENDING "	"COMPLETED"	2037	"2017-08-14"	0	0	0	0	1	0	0	0	0	0	0	0	0	2017	8
"NIL"	"NIL"	"SIMPLE ASSAULT"	"BREWERVILLE"	"PERRY TOWN COMMUNITY"	"8/2/2017"	"06:00 PM - 09:00 PM"	"WITHDRAWN"	"COMPLETED"	6011	"2017-08-02"	0	0	0	1	0	0	0	0	0	0	0	0	0	2017	8
"NIL"	"NIL"	"AGGRAVATED ASSAULT"	"PAYNESVILLE"	"PEACE ISLAND COMMUNITY"	"7/9/2017"	"09:00 AM - 12:00 PM "	"COURT"	"COMPLETED "	9029	"2017-07-09"	0	0	1	0	0	0	0	0	0	0	0	0	0	2017	7
"NIL"	"NIL"	"TERRORISTIC THREAT"	"PAYNESVILLE"	"72ND COMMUNITY "	"7/9/2017"	"09:00 AM - 12:00 PM "	"COURT"	"COMPLETED "	9012	"2017-07-09"	0	0	0	0	0	0	0	0	0	0	0	0	1	2017	7
"NIL"	"NIL"	"PROPERTY THEFT"	"PAYNESVILLE"	"NEEZO COMMUNITY "	"7/15/2017"	"03:00 PM - 06:00 PM"	"PENDING"	"COMPLETED "	9018	"2017-07-15"	0	0	0	0	0	0	0	0	0	0	0	0	1	2017	7
"NIL"	"NIL"	"BURGLARY"	"PAYNESVILLE"	"SKD BOULEVARD COMMUNITY "	"8/11/2017"	"09:00 AM - 12:00 PM "	"WITHDRAWN "	"COMPLETED "	3014	"2017-08-11"	0	1	0	0	0	0	0	0	0	0	0	0	0	2017	8
"NIL"	"NIL"	"ROBBERY"	"PAYNESVILLE"	"SKD BOULEVARD COMMUNITY "	"8/17/2017"	"03:00 PM - 06:00 PM"	"PENDING"	"COMPLETED "	3014	"2017-08-17"	0	1	0	0	0	0	0	0	0	0	0	0	0	2017	8
"NIL"	"NIL"	"MENACING"	"PAYNESVILLE"	"MORRISON FARM COMMUNITY"	"7/21/2017"	"06:00 PM - 09:00 PM"	"WITHDRAWN "	"COMPLETED "	9021	"2017-07-21"	0	0	0	0	0	0	0	0	0	0	0	0	1	2017	7
"NIL"	"NIL"	"AGGRAVATED ASSAULT"	"CENTRAL MONROVIA"	"PHP COMMUNITY"	"7/23/2017"	"09:00 AM - 12:00 PM "	"WITHDRAWN "	"COMPLETED "	2004	"2017-07-23"	0	0	1	0	0	0	0	0	0	0	0	0	0	2017	7
"NIL"	"NIL"	"ARMED ROBBERY"	"BUSHROD ISLAND"	"DUALA COMMUNITY "	"8/20/2017"	"03:00 AM - 06:00 AM"	"COURT"	"COMPLETED "	1014	"2017-08-20"	1	0	0	0	0	0	0	0	0	0	0	0	0	2017	8
"NIL"	"NIL"	"AGGRAVATED ASSAULT"	"BUSHROD ISLAND"	"POINT FOUR COMMUNITY"	"8/20/2017"	"00:00 AM - 03:00 AM"	"PENDING"	"COMPLETED "	1001	"2017-08-20"	0	0	1	0	0	0	0	0	0	0	0	0	0	2017	8
"NIL"	"NIL"	"AGGRAVATED ASSAULT"	"BUSHROD ISLAND"	"POPO BEACH COMMUNITY"	"8/4/2017"	"06:00 AM - 09:00 AM"	"COURT"	"COMPLETED "	1005	"2017-08-04"	0	0	1	0	0	0	0	0	0	0	0	0	0	2017	8
"NIL"	"NIL"	"PROPERTY THEFT"	"BUSHROD ISLAND"	"DUALA COMMUNITY"	"8/15/2017"	"03:00 PM - 06:00 PM"	"COURT"	"COMPLETED "	1014	"2017-08-15"	0	0	0	0	0	0	0	0	0	0	0	0	1	2017	8
"NIL"	"NIL"	"PROPERTY THEFT"	"SINKOR"	"11TH STREET COMMUNITY"	"8/19/2017"	"09:00 AM - 12:00 PM "	"PENDING"	"COMPLETED "	2027	"2017-08-19"	0	0	0	0	0	0	0	0	0	0	0	0	1	2017	8
"NIL"	"NIL"	"PROPERTY THEFT"	"CENTRAL MONROVIA"	"UN DRIVE COMMUNITY"	"8/17/2017"	"12:00 PM - 03:00 PM"	"PENDING"	"COMPLETED "	2001	"2017-08-17"	0	0	0	0	0	0	0	0	0	0	0	0	1	2017	8
"NIL"	"NIL"	"PROPERTY THEFT"	"CENTRAL MONROVIA"	"CAREY STREET COMMUNITY"	"8/8/2017"	"06:00 PM - 09:00 PM"	"WITHDRAWN "	"COMPLETED "	2010	"2017-08-08"	0	0	0	0	0	0	0	0	0	0	0	0	1	2017	8
"NIL"	"NIL"	"PROPERTY THEFT"	"SINKOR"	"15TH STREET COMMUNITY"	"8/14/2017"	"09:00 AM - 12:00 PM "	"WITHDRAWN "	"COMPLETED "	2023	"2017-08-14"	0	0	0	0	0	0	0	0	0	0	0	0	1	2017	8
"NIL"	"NIL"	"PROPERTY THEFT"	"SINKOR"	"11TH STREET COMMUNITY"	"8/28/2017"	"06:00 AM - 09:00 AM"	"PENDING"	"COMPLETED "	2027	"2017-08-28"	0	0	0	0	0	0	0	0	0	0	0	0	1	2017	8
"NIL"	"NIL"	"MISAPPLICATION OF ENTRUSTED PROPERTY"	"PAYNESVILLE"	"GSA ROAD COMMUNITY"	"8/15/2017"	"12:00 PM - 03:00 PM"	"COURT"	"COMPLETED "	5002	"2017-08-15"	0	1	0	0	0	0	0	0	0	0	0	0	0	2017	8
"NIL"	"NIL"	"PROPERTY THEFT"	"PAYNESVILLE"	"SOUL CLINIC COMMUNITY"	"7/15/2017"	"12:00 PM - 03:00 PM"	"WITHDRAWN "	"COMPLETED "	5014	"2017-07-15"	0	0	0	0	0	0	0	0	0	0	0	0	1	2017	7
"NIL"	"NIL"	"PROPERTY THEFT"	"PAYNESVILLE"	"SOUL CLINIC COMMUNITY"	"7/9/2017"	"09:00 AM - 12:00 PM "	"COURT"	"COMPLETED "	5014	"2017-07-09"	0	0	0	0	0	0	0	0	0	0	0	0	1	2017	7
"NIL"	"NIL"	"PROPERTY THEFT"	"PAYNESVILLE"	"SOUL CLINIC COMMUNITY"	"7/10/2017"	"09:00 AM - 12:00 PM "	"COURT"	"COMPLETED "	5014	"2017-07-10"	0	0	0	0	0	0	0	0	0	0	0	0	1	2017	7
"NIL"	"NIL"	"PROPERTY THEFT"	"PAYNESVILLE"	"SOUL CLINIC COMMUNITY"	"6/12/2017"	"09:00 AM - 12:00 PM "	"COURT"	"COMPLETED "	5014	"2017-06-12"	0	0	0	0	0	0	0	0	0	0	0	0	1	2017	6
"NIL"	"NIL"	"PROPERTY THEFT"	"PAYNESVILLE"	"SOUL CLINIC COMMUNITY"	"7/23/2017"	"06:00 AM - 09:00 AM"	"WITHDRAWN "	"COMPLETED "	5014	"2017-07-23"	0	0	0	0	0	0	0	0	0	0	0	0	1	2017	7
"NIL"	"NIL"	"SIMPLE ASSAULT"	"PAYNESVILLE"	"SOUL CLINIC COMMUNITY"	"7/27/2017"	"06:00 AM - 09:00 AM"	"WITHDRAWN "	"COMPLETED "	5014	"2017-07-27"	0	0	0	1	0	0	0	0	0	0	0	0	0	2017	7
"NIL"	"NIL"	"PROPERTY THEFT"	"PAYNESVILLE"	"SOUL CLINIC COMMUNITY"	"7/29/2017"	"09:00 PM - 00:00 AM"	"WITHDRAWN "	"COMPLETED "	5014	"2017-07-29"	0	0	0	0	0	0	0	0	0	0	0	0	1	2017	7
"NIL"	"NIL"	"SIMPLE ASSAULT"	"PAYNESVILLE"	"SOUL CLINIC COMMUNITY"	"7/30/2017"	"09:00 AM - 12:00 PM "	"WITHDRAWN "	"COMPLETED "	5014	"2017-07-30"	0	0	0	1	0	0	0	0	0	0	0	0	0	2017	7
"NIL"	"NIL"	"PROPERTY THEFT"	"PAYNESVILLE"	"SOUL CLINIC COMMUNITY"	"8/1/2017"	"12:00 PM - 03:00 PM"	"PENDING"	"COMPLETED "	5014	"2017-08-01"	0	0	0	0	0	0	0	0	0	0	0	0	1	2017	8
"NIL"	"NIL"	"CRIMINAL COERCION"	"PAYNESVILLE"	"SOUL CLINIC COMMUNITY"	"8/3/2017"	"12:00 PM - 03:00 PM"	"WITHDRAWN "	"COMPLETED "	5014	"2017-08-03"	0	0	0	0	0	0	0	0	0	0	0	0	1	2017	8
"NIL"	"NIL"	"MISAPPLICATION OF ENTRUSTED PROPERTY"	"PAYNESVILLE"	"SOUL CLINIC COMMUNITY"	"8/6/2017"	"03:00 PM - 06:00 PM"	"WITHDRAWN "	"COMPLETED "	5014	"2017-08-06"	0	1	0	0	0	0	0	0	0	0	0	0	0	2017	8
"NIL"	"NIL"	"PROPERTY THEFT"	"PAYNESVILLE"	"SOUL CLINIC COMMUNITY"	"8/10/2017"	"12:00 PM - 03:00 PM"	"WITHDRAWN "	"COMPLETED "	5014	"2017-08-10"	0	0	0	0	0	0	0	0	0	0	0	0	1	2017	8
"NIL"	"NIL"	"PROPERTY THEFT"	"PAYNESVILLE"	"SOUL CLINIC COMMUNITY"	"8/10/2017"	"12:00 PM - 03:00 PM"	"WITHDRAWN "	"COMPLETED "	5014	"2017-08-10"	0	0	0	0	0	0	0	0	0	0	0	0	1	2017	8
"NIL"	"NIL"	"PROPERTY THEFT"	"PAYNESVILLE"	"SOUL CLINIC COMMUNITY"	"8/10/2017"	"12:00 PM - 03:00 PM"	"WITHDRAWN "	"COMPLETED "	5014	"2017-08-10"	0	0	0	0	0	0	0	0	0	0	0	0	1	2017	8
"NIL"	"NIL"	"PROPERTY THEFT"	"PAYNESVILLE"	"SOUL CLINIC COMMUNITY"	"8/11/2017"	"03:00 PM - 06:00 PM"	"WITHDRAWN "	"COMPLETED "	5014	"2017-08-11"	0	0	0	0	0	0	0	0	0	0	0	0	1	2017	8
"NIL"	"NIL"	"SIMPLE ASSAULT"	"PAYNESVILLE"	"SOUL CLINIC COMMUNITY"	"8/3/2017"	"09:00 PM - 00:00 AM"	"WITHDRAWN "	"COMPLETED "	5014	"2017-08-03"	0	0	0	1	0	0	0	0	0	0	0	0	0	2017	8
"NIL"	"NIL"	"SIMPLE ASSAULT"	"PAYNESVILLE"	"SOUL CLINIC COMMUNITY"	"8/3/2017"	"09:00 PM - 00:00 AM"	"WITHDRAWN "	"COMPLETED "	5014	"2017-08-03"	0	0	0	1	0	0	0	0	0	0	0	0	0	2017	8
"NIL"	"NIL"	"PROPERTY THEFT"	"PAYNESVILLE"	"SOUL CLINIC COMMUNITY"	"8/4/2017"	"09:00 PM - 00:00 AM"	"WITHDRAWN "	"COMPLETED "	5014	"2017-08-04"	0	0	0	0	0	0	0	0	0	0	0	0	1	2017	8
"NIL"	"NIL"	"DISORDERLY CONDUCT"	"PAYNESVILLE"	"SOUL CLINIC COMMUNITY"	"8/7/2017"	"09:00 PM - 00:00 AM"	"WITHDRAWN "	"COMPLETED "	5014	"2017-08-07"	0	0	0	0	0	0	0	0	0	0	0	0	1	2017	8
"NIL"	"NIL"	"CRIMINAL MISCHIEF"	"PAYNESVILLE"	"SOUL CLINIC COMMUNITY"	"8/16/2017"	"06:00 AM - 09:00 AM"	"WITHDRAWN "	"COMPLETED "	5014	"2017-08-16"	0	0	0	0	0	0	0	0	0	0	0	0	1	2017	8
"NIL"	"NIL"	"SIMPLE ASSAULT"	"PAYNESVILLE"	"THINKERVILLAGE COMMUNITY"	"7/21/2017"	"09:00 AM - 12:00 PM "	"WITHDRAWN "	"COMPLETED "	8013	"2017-07-21"	0	0	0	1	0	0	0	0	0	0	0	0	0	2017	7
"NIL"	"NIL"	"SIMPLE ASSAULT"	"PAYNESVILLE"	"THINKERVILLAGE COMMUNITY"	"7/28/2017"	"09:00 PM - 00:00 AM"	"PENDING"	"COMPLETED "	8013	"2017-07-28"	0	0	0	1	0	0	0	0	0	0	0	0	0	2017	7
"NIL"	"NIL"	"SIMPLE ASSAULT"	"PAYNESVILLE"	"THINKERVILLAGE COMMUNITY"	"7/28/2017"	"09:00 PM - 00:00 AM"	"PENDING"	"COMPLETED "	8013	"2017-07-28"	0	0	0	1	0	0	0	0	0	0	0	0	0	2017	7
"NIL"	"NIL"	"PROPERTY THEFT"	"PAYNESVILLE"	"THINKERVILLAGE COMMUNITY"	"8/8/2017"	"09:00 AM - 12:00 PM "	"WITHDRAWN "	"COMPLETED "	8013	"2017-08-08"	0	0	0	0	0	0	0	0	0	0	0	0	1	2017	8
"NIL"	"NIL"	"DISORDERLY CONDUCT"	"PAYNESVILLE"	"THINKERVILLAGE COMMUNITY"	"8/8/2017"	"09:00 AM - 12:00 PM "	"WITHDRAWN "	"COMPLETED "	8013	"2017-08-08"	0	0	0	0	0	0	0	0	0	0	0	0	1	2017	8
"NIL"	"NIL"	"RAPE"	"PAYNESVILLE"	"R 2 COMMUNITY"	"8/9/2017"	"09:00 PM - 00:00 AM"	"WITHDRAWN "	"COMPLETED "	8017	"2017-08-09"	0	0	0	0	1	0	0	0	0	0	0	0	0	2017	8
"NIL"	"NIL"	"MISAPPLICATION OF ENTRUSTED PROPERTY"	"PAYNESVILLE"	"THINKERVILLAGE COMMUNITY"	"7/10/2017"	"06:00 PM - 09:00 PM"	"COURT"	"COMPLETED "	8013	"2017-07-10"	0	1	0	0	0	0	0	0	0	0	0	0	0	2017	7
"NIL"	"NIL"	"MISAPPLICATION OF ENTRUSTED PROPERTY"	"PAYNESVILLE"	"THINKERVILLAGE COMMUNITY"	"8/4/2017"	"06:00 PM - 09:00 PM"	"WITHDRAWN "	"COMPLETED "	8013	"2017-08-04"	0	1	0	0	0	0	0	0	0	0	0	0	0	2017	8
"NIL"	"NIL"	"SIMPLE ASSAULT"	"PAYNESVILLE"	"REHAB COMMUNITY"	"7/27/2017"	"09:00 AM - 12:00 PM "	"WITHDRAWN "	"COMPLETED "	8006	"2017-07-27"	0	0	0	1	0	0	0	0	0	0	0	0	0	2017	7
"NIL"	"NIL"	"ROBBERY"	"PAYNESVILLE"	"ELWA COMMUNITY"	"7/27/2017"	"12:00 PM - 03:00 PM"	"COURT"	"COMPLETED "	8005	"2017-07-27"	0	1	0	0	0	0	0	0	0	0	0	0	0	2017	7
"NIL"	"NIL"	"ILLEGAL POSSESSION OF DRUGS"	"PAYNESVILLE"	"ELWA COMMUNITY"	"6/13/2017"	"06:00 AM - 09:00 AM"	"COURT"	"COMPLETED "	8005	"2017-06-13"	0	0	0	0	0	0	0	0	0	0	0	0	1	2017	6
"NIL"	"NIL"	"PROPERTY THEFT"	"PAYNESVILLE"	"REHAB COMMUNITY"	"6/14/2017"	"06:00 PM - 09:00 PM"	"COURT"	"COMPLETED "	8006	"2017-06-14"	0	0	0	0	0	0	0	0	0	0	0	0	1	2017	6
"NIL"	"NIL"	"PROPERTY THEFT"	"PAYNESVILLE"	"THINKERVILLAGE COMMUNITY "	"7/20/2017"	"12:00 PM - 03:00 PM"	"COURT"	"COMPLETED "	8013	"2017-07-20"	0	0	0	0	0	0	0	0	0	0	0	0	1	2017	7
"NIL"	"NIL"	"ROBBERY"	"PAYNESVILLE"	"ELWA COMMUNITY"	"7/20/2017"	"09:00 AM - 12:00 PM "	"COURT"	"COMPLETED "	8005	"2017-07-20"	0	1	0	0	0	0	0	0	0	0	0	0	0	2017	7
"NIL"	"NIL"	"AGGRAVATED ASSAULT"	"PAYNESVILLE"	"THINKERVILLAGE COMMUNITY"	"7/24/2017"	"06:00 PM - 09:00 PM"	"COURT"	"COMPLETED "	8013	"2017-07-24"	0	0	1	0	0	0	0	0	0	0	0	0	0	2017	7
"NIL"	"NIL"	"BURGLARY"	"PAYNESVILLE"	"THINKERVILLAGE COMMUNITY"	"7/24/2017"	"09:00 AM - 12:00 PM "	"WITHDRAWN "	"COMPLETED "	8013	"2017-07-24"	0	1	0	0	0	0	0	0	0	0	0	0	0	2017	7
"NIL"	"NIL"	"PROPERTY THEFT"	"PAYNESVILLE"	"THINKERVILLAGE COMMUNITY"	"7/27/2017"	"12:00 PM - 03:00 PM"	"WITHDRAWN "	"COMPLETED "	8013	"2017-07-27"	0	0	0	0	0	0	0	0	0	0	0	0	1	2017	7
"NIL"	"NIL"	"BURGLARY"	"PAYNESVILLE"	"THINKERVILLAGE COMMUNITY"	"7/28/2017"	"09:00 AM - 12:00 PM "	"WITHDRAWN "	"COMPLETED "	8013	"2017-07-28"	0	1	0	0	0	0	0	0	0	0	0	0	0	2017	7
"NIL"	"NIL"	"PROPERTY THEFT"	"PAYNESVILLE"	"THINKERVILLAGE COMMUNITY"	"7/31/2017"	"09:00 AM - 12:00 PM "	"WITHDRAWN "	"COMPLETED "	8013	"2017-07-31"	0	0	0	0	0	0	0	0	0	0	0	0	1	2017	7
"NIL"	"NIL"	"PROPERTY THEFT"	"PAYNESVILLE"	"REHAB COMMUNITY"	"8/6/2017"	"09:00 AM - 12:00 PM "	"WITHDRAWN "	"COMPLETED "	8006	"2017-08-06"	0	0	0	0	0	0	0	0	0	0	0	0	1	2017	8
"NIL"	"NIL"	"PROPERTY THEFT"	"PAYNESVILLE"	"ELWA COMMUNITY"	"8/11/2017"	"06:00 AM - 09:00 AM"	"WITHDRAWN "	"COMPLETED "	8005	"2017-08-11"	0	0	0	0	0	0	0	0	0	0	0	0	1	2017	8
"NIL"	"NIL"	"PROPERTY THEFT"	"PAYNESVILLE"	"ELWA COMMUNITY"	"8/11/2017"	"09:00 AM - 12:00 PM "	"WITHDRAWN "	"COMPLETED "	8005	"2017-08-11"	0	0	0	0	0	0	0	0	0	0	0	0	1	2017	8
"NIL"	"NIL"	"PROPERTY THEFT"	"BUSHROD ISLAND"	"DOE COMMUNITY"	"7/6/2017"	"06:00 AM - 09:00 AM"	"COURT"	"COMPLETED "	10004	"2017-07-06"	0	0	0	0	0	0	0	0	0	0	0	0	1	2017	7
"NIL"	"NIL"	"PROPERTY THEFT"	"BUSHROD ISLAND"	"DOE COMMUNITY"	"7/14/2017"	"03:00 PM - 06:00 PM"	"COURT"	"COMPLETED "	10004	"2017-07-14"	0	0	0	0	0	0	0	0	0	0	0	0	1	2017	7
"NIL"	"NIL"	"TERRORISTIC THREAT"	"BUSHROD ISLAND"	"DOE COMMUNITY"	"7/18/2017"	"12:00 PM - 03:00 PM"	"PENDING"	"COMPLETED "	10004	"2017-07-18"	0	0	0	0	0	0	0	0	0	0	0	0	1	2017	7
"NIL"	"NIL"	"SIMPLE ASSAULT"	"BUSHROD ISLAND"	"DOE COMMUNITY"	"                          8/22/2017"	"09:00 AM - 12:00 PM "	"PENDING"	"COMPLETED "	10004	"2017-08-22"	0	0	0	1	0	0	0	0	0	0	0	0	0	2017	8
"NIL"	"NIL"	"MISAPPLICATION OF ENTRUSTED PROPERTY"	"BUSHROD ISLAND"	"CLARA TOWN COMMUNITY "	"8/23/2017"	"09:00 AM - 12:00 PM "	"PENDING"	"COMPLETED "	10002	"2017-08-23"	0	1	0	0	0	0	0	0	0	0	0	0	0	2017	8
"NIL"	"NIL"	"PROPERTY THEFT"	"SINKOR"	"11TH STREET COMMUNITY"	"8/18/2017"	"06:00 AM - 09:00 AM"	"WITHDRAWN"	"COMPLETED"	2027	"2017-08-18"	0	0	0	0	0	0	0	0	0	0	0	0	1	2017	8
"NIL"	"NIL"	"SIMPLE ASSAULT"	"BUSHROD ISLAND"	"CLARA TOWN COMMUNITY"	"9/13/2017"	"09:00 AM - 12:00 PM"	"WITHDRAWN"	"COMPLETED"	10002	"2017-09-13"	0	0	0	1	0	0	0	0	0	0	0	0	0	2017	9
"NIL"	"NIL"	"SIMPLE ASSAULT"	"CENTRAL MONROVIA"	"PHP COMMUNITY"	"9/12/2017"	"03:00 PM - 06:00 PM"	"WITHDRAWN"	"COMPLETED"	2004	"2017-09-12"	0	0	0	1	0	0	0	0	0	0	0	0	0	2017	9
"NIL"	"NIL"	"PROPERTY THEFT"	"PAYNESVILLE"	"COCOLA FACTORY COMMUNITY"	"8/27/2017"	"09:00 PM - 00:00 AM"	"WITHDRAWN"	"COMPLETED"	9020	"2017-08-27"	0	0	0	0	0	0	0	0	0	0	0	0	1	2017	8
"NIL"	"NIL"	"CRIMINAL TRESPASS"	"PAYNESVILLE"	"SOUL CLINIC COMMUNITY"	"9/4/2017"	"12:00 PM - 03:00 PM"	"COURT"	"COMPLETED"	5014	"2017-09-04"	0	0	0	0	0	0	0	0	0	0	0	0	1	2017	9
"NIL"	"NIL"	"AGGRAVATED ASSAULT"	"PAYNESVILLE"	"GSA ROAD COMMUNITY"	"9/7/2017"	"09:00 AM - 12:00 PM"	"COURT"	"COMPLETED"	5002	"2017-09-07"	0	0	1	0	0	0	0	0	0	0	0	0	0	2017	9
"NIL"	"NIL"	"SIMPLE ASSAULT"	"PAYNESVILLE"	"PARKER PAINT COMMUNITY"	"8/20/2017"	"03:00 AM - 06:00 AM"	"WITHDRAWN"	"COMPLETED"	5013	"2017-08-20"	0	0	0	1	0	0	0	0	0	0	0	0	0	2017	8
"NIL"	"NIL"	"SIMPLE ASSAULT"	"PAYNESVILLE"	"SOUL CLINIC COMMUNITY"	"9/16/2017"	"03:00 PM - 06:00 PM"	"WITHDRAWN"	"COMPLETED"	5014	"2017-09-16"	0	0	0	1	0	0	0	0	0	0	0	0	0	2017	9
"NIL"	"NIL"	"PROPERTY THEFT"	"PAYNESVILLE"	"SOUL CLINIC COMMUNITY"	"8/20/2017"	"06:00 AM - 09:00 AM"	"COURT"	"COMPLETED"	5014	"2017-08-20"	0	0	0	0	0	0	0	0	0	0	0	0	1	2017	8
"NIL"	"NIL"	"PROPERTY THEFT"	"PAYNESVILLE"	"SOUL CLINIC COMMUNITY"	"8/22/2017"	"06:00 AM - 09:00 AM"	"WITHDRAWN"	"COMPLETED"	5014	"2017-08-22"	0	0	0	0	0	0	0	0	0	0	0	0	1	2017	8
"NIL"	"NIL"	"CRIMINAL  MISCHIEF"	"PAYNESVILLE"	"SOUL CLINIC COMMUNITY"	"8/23/2017"	"09:00 AM - 12:00 PM"	"PENDING"	"COMPLETED"	5014	"2017-08-23"	0	0	0	0	0	0	0	0	0	0	0	0	1	2017	8
"NIL"	"NIL"	"MENACING"	"PAYNESVILLE"	"SOUL CLINIC COMMUNITY"	"8/29/2017"	"06:00 AM - 09:00 AM"	"WITHDRAWN"	"COMPLETED"	5014	"2017-08-29"	0	0	0	0	0	0	0	0	0	0	0	0	1	2017	8
"NIL"	"NIL"	"SIMPLE ASSAULT"	"PAYNESVILLE"	"SOUL CLINIC COMMUNITY"	"8/29/2017"	"09:00 AM - 12:00 PM"	"WITHDRAWN"	"COMPLETED"	5014	"2017-08-29"	0	0	0	1	0	0	0	0	0	0	0	0	0	2017	8
"NIL"	"NIL"	"PROPERTY THEFT"	"PAYNESVILLE"	"SOUL CLINIC COMMUNITY"	"8/29/2017"	"09:00 AM - 12:00 PM"	"WITHDRAWN"	"COMPLETED"	5014	"2017-08-29"	0	0	0	0	0	0	0	0	0	0	0	0	1	2017	8
"NIL"	"NIL"	"PROPERTY THEFT"	"PAYNESVILLE"	"SOUL CLINIC COMMUNITY"	"8/30/2017"	"06:00 AM - 09:00 AM"	"WITHDRAWN"	"COMPLETED"	5014	"2017-08-30"	0	0	0	0	0	0	0	0	0	0	0	0	1	2017	8
"NIL"	"NIL"	"SIMPLE ASSAULT"	"PAYNESVILLE"	"SOUL CLINIC COMMUNITY"	"9/1/2017"	"06:00 AM - 09:00 AM"	"WITHDRAWN"	"COMPLETED"	5014	"2017-09-01"	0	0	0	1	0	0	0	0	0	0	0	0	0	2017	9
"NIL"	"NIL"	"PROPERTY THEFT"	"PAYNESVILLE"	"SOUL CLINIC COMMUNITY"	"9/2/2017"	"09:00 AM - 12:00 PM"	"WITHDRAWN"	"COMPLETED"	5014	"2017-09-02"	0	0	0	0	0	0	0	0	0	0	0	0	1	2017	9
"NIL"	"NIL"	"CRIMINAL  MISCHIEF"	"PAYNESVILLE"	"SOUL CLINIC COMMUNITY"	"9/5/2017"	"06:00 AM - 09:00 AM"	"WITHDRAWN"	"COMPLETED"	5014	"2017-09-05"	0	0	0	0	0	0	0	0	0	0	0	0	1	2017	9
"NIL"	"NIL"	"PROPERTY THEFT"	"PAYNESVILLE"	"SOUL CLINIC COMMUNITY"	"9/5/2017"	"09:00 AM - 12:00 PM"	"PENDING"	"COMPLETED"	5014	"2017-09-05"	0	0	0	0	0	0	0	0	0	0	0	0	1	2017	9
"NIL"	"NIL"	"CRIMINAL  MISCHIEF"	"PAYNESVILLE"	"ZUBAH TOWN COMMUNITY"	"9/15/2017"	"06:00 PM - 09:00 PM"	"WITHDRAWN"	"COMPLETED"	5008	"2017-09-15"	0	0	0	0	0	0	0	0	0	0	0	0	1	2017	9
"NIL"	"NIL"	"PROPERTY THEFT"	"BUSHROD ISLAND"	"DOE COMMUNITY"	"9/2/2017"	"06:00 AM - 09:00 AM"	"COURT"	"COMPLETED"	10004	"2017-09-02"	0	0	0	0	0	0	0	0	0	0	0	0	1	2017	9
"NIL"	"NIL"	"AGGRAVATED ASSAULT"	"BUSHROD ISLAND"	"DOE COMMUNITY"	"9/4/2017"	"06:00 PM - 09:00 PM"	"COURT"	"COMPLETED"	10004	"2017-09-04"	0	0	1	0	0	0	0	0	0	0	0	0	0	2017	9
"NIL"	"NIL"	"CRIMINAL  MISCHIEF"	"BUSHROD ISLAND"	"DOE COMMUNITY"	"9/5/2017"	"12:00 PM - 03:00 PM"	"PENDING"	"COMPLETED"	10004	"2017-09-05"	0	0	0	0	0	0	0	0	0	0	0	0	1	2017	9
"NIL"	"NIL"	"CRIMINAL  MISCHIEF"	"BUSHROD ISLAND"	"DOE COMMUNITY"	"9/7/2017"	"12:00 PM - 03:00 PM"	"COURT"	"COMPLETED"	10004	"2017-09-07"	0	0	0	0	0	0	0	0	0	0	0	0	1	2017	9
"NIL"	"NIL"	"SIMPLE ASSAULT"	"BUSHROD ISLAND"	"DOE COMMUNITY"	"9/8/2017"	"09:00 AM - 12:00 PM"	"COURT"	"COMPLETED"	10004	"2017-09-08"	0	0	0	1	0	0	0	0	0	0	0	0	0	2017	9
"NIL"	"NIL"	"PROPERTY THEFT"	"BUSHROD ISLAND"	"DOE COMMUNITY"	"9/9/2017"	"12:00 PM - 03:00 PM"	"PENDING"	"COMPLETED"	10004	"2017-09-09"	0	0	0	0	0	0	0	0	0	0	0	0	1	2017	9
"NIL"	"NIL"	"PROPERTY THEFT"	"BUSHROD ISLAND"	"DOE COMMUNITY"	"9/10/2017"	"09:00 AM - 12:00 PM"	"WITHDRAWN"	"COMPLETED"	10004	"2017-09-10"	0	0	0	0	0	0	0	0	0	0	0	0	1	2017	9
"NIL"	"NIL"	"SIMPLE ASSAULT"	"BUSHROD ISLAND"	"DOE COMMUNITY"	"9/12/2017"	"09:00 AM - 12:00 PM"	"COURT"	"COMPLETED"	10004	"2017-09-12"	0	0	0	1	0	0	0	0	0	0	0	0	0	2017	9
"NIL"	"NIL"	"AGGRAVATED ASSAULT"	"BUSHROD ISLAND"	"DOE COMMUNITY"	"9/14/2017"	"12:00 PM - 03:00 PM"	"COURT"	"COMPLETED"	10004	"2017-09-14"	0	0	1	0	0	0	0	0	0	0	0	0	0	2017	9
"NIL"	"NIL"	"DISORDERLY CONDUCT"	"BUSHROD ISLAND"	"DOE COMMUNITY"	"9/17/2017"	"12:00 PM - 03:00 PM"	"COURT"	"COMPLETED"	10004	"2017-09-17"	0	0	0	0	0	0	0	0	0	0	0	0	1	2017	9
"NIL"	"NIL"	"DISORDERLY CONDUCT"	"BUSHROD ISLAND"	"DOE COMMUNITY"	"9/18/2017"	"06:00 PM - 09:00 PM"	"WITHDRAWN"	"COMPLETED"	10004	"2017-09-18"	0	0	0	0	0	0	0	0	0	0	0	0	1	2017	9
"NIL"	"NIL"	"SIMPLE ASSAULT"	"BUSHROD ISLAND"	"DOE COMMUNITY"	"9/19/2017"	"12:00 PM - 03:00 PM"	"WITHDRAWN"	"COMPLETED"	10004	"2017-09-19"	0	0	0	1	0	0	0	0	0	0	0	0	0	2017	9
"NIL"	"NIL"	"AGGRAVATED ASSAULT"	"BUSHROD ISLAND"	"DOE COMMUNITY"	"9/20/2017"	"12:00 PM - 03:00 PM"	"COURT"	"COMPLETED"	10004	"2017-09-20"	0	0	1	0	0	0	0	0	0	0	0	0	0	2017	9
"NIL"	"NIL"	"DISORDERLY CONDUCT"	"BUSHROD ISLAND"	"DOE COMMUNITY"	"9/21/2017"	"09:00 AM - 12:00 PM"	"WITHDRAWN"	"COMPLETED"	10004	"2017-09-21"	0	0	0	0	0	0	0	0	0	0	0	0	1	2017	9
"NIL"	"NIL"	"DISORDERLY CONDUCT"	"BUSHROD ISLAND"	"DOE COMMUNITY"	"9/22/2017"	"12:00 PM - 03:00 PM"	"WITHDRAWN"	"COMPLETED"	10004	"2017-09-22"	0	0	0	0	0	0	0	0	0	0	0	0	1	2017	9
"NIL"	"NIL"	"SIMPLE ASSAULT"	"BUSHROD ISLAND"	"CLARA TOWN COMMUNITY"	"9/1/2017"	"12:00 PM - 03:00 PM"	"WITHDRAWN"	"COMPLETED"	10002	"2017-09-01"	0	0	0	1	0	0	0	0	0	0	0	0	0	2017	9
"NIL"	"NIL"	"CRIMINAL  MISCHIEF"	"BUSHROD ISLAND"	"CLARA TOWN COMMUNITY"	"9/2/2017"	"06:00 AM - 09:00 AM"	"PENDING"	"COMPLETED"	10002	"2017-09-02"	0	0	0	0	0	0	0	0	0	0	0	0	1	2017	9
"NIL"	"NIL"	"INTERFERING WITH CHILD CUSTODY"	"BUSHROD ISLAND"	"CLARA TOWN COMMUNITY"	"9/2/2017"	"12:00 PM - 03:00 PM"	"WITHDRAWN"	"COMPLETED"	10002	"2017-09-02"	0	0	0	0	0	0	0	0	0	0	0	0	1	2017	9
"NIL"	"NIL"	"CRIMINAL TRESPASS"	"BUSHROD ISLAND"	"JAMAICA ROAD COMMUNITY"	"9/2/2017"	"06:00 PM - 09:00 PM"	"WITHDRAWN"	"COMPLETED"	10020	"2017-09-02"	0	0	0	0	0	0	0	0	0	0	0	0	1	2017	9
"NIL"	"NIL"	"PROPERTY THEFT"	"BUSHROD ISLAND"	"JAMAICA ROAD COMMUNITY"	"9/4/2017"	"03:00 PM - 06:00 PM"	"WITHDRAWN"	"COMPLETED"	10020	"2017-09-04"	0	0	0	0	0	0	0	0	0	0	0	0	1	2017	9
"NIL"	"NIL"	"PROPERTY THEFT"	"BUSHROD ISLAND"	"CLARA TOWN COMMUNITY"	"9/5/2017"	"06:00 AM - 09:00 AM"	"PENDING"	"COMPLETED"	10002	"2017-09-05"	0	0	0	0	0	0	0	0	0	0	0	0	1	2017	9
"NIL"	"NIL"	"PROPERTY THEFT"	"BUSHROD ISLAND"	"CLARA TOWN COMMUNITY"	"9/6/2017"	"09:00 AM - 12:00 PM"	"WITHDRAWN"	"COMPLETED"	10002	"2017-09-06"	0	0	0	0	0	0	0	0	0	0	0	0	1	2017	9
"NIL"	"NIL"	"PROPERTY THEFT"	"SINKOR"	"11TH STREET COMMUNITY"	"9/22/2017"	"09:00 AM - 12:00 PM"	"WITHDRAWN"	"COMPLETED"	2027	"2017-09-22"	0	0	0	0	0	0	0	0	0	0	0	0	1	2017	9
"NIL"	"NIL"	"PROPERTY THEFT"	"BREWERVILLE"	"MORRIS TOWN COMMUNITY"	"9/8/2017"	"NIL"	"WITHDRAWN"	"COMPLETED"	9021	"2017-09-08"	0	0	0	0	0	0	0	0	0	0	0	0	1	2017	9
"NIL"	"NIL"	"AGGRAVATED ASSAULT"	"BUSHROD ISLAND"	"POINT FOUR COMMUNITY"	"8/28/2017"	"09:00 PM - 00:00 AM"	"COURT"	"COMPLETED"	1001	"2017-08-28"	0	0	1	0	0	0	0	0	0	0	0	0	0	2017	8
"NIL"	"NIL"	"AGGRAVATED ASSAULT"	"BUSHROD ISLAND"	"POINT FOUR COMMUNITY"	"6/4/2017"	"06:00 AM - 09:00 AM"	"COURT"	"COMPLETED"	1001	"2017-06-04"	0	0	1	0	0	0	0	0	0	0	0	0	0	2017	6
"NIL"	"NIL"	"MENACING"	"BUSHROD ISLAND"	"POINT FOUR COMMUNITY"	"9/1/2017"	"12:00 PM - 03:00 PM"	"COURT"	"COMPLETED"	1001	"2017-09-01"	0	0	0	0	0	0	0	0	0	0	0	0	1	2017	9
"NIL"	"NIL"	"AGGRAVATED ASSAULT"	"BUSHROD ISLAND"	"POINT FOUR COMMUNITY"	"9/15/2017"	"03:00 PM - 06:00 PM"	"PENDING"	"COMPLETED"	1001	"2017-09-15"	0	0	1	0	0	0	0	0	0	0	0	0	0	2017	9
"NIL"	"NIL"	"AGGRAVATED ASSAULT"	"BUSHROD ISLAND"	"POINT FOUR COMMUNITY"	"9/17/2017"	"12:00 PM - 03:00 PM"	"WITHDRAWN"	"COMPLETED"	1001	"2017-09-17"	0	0	1	0	0	0	0	0	0	0	0	0	0	2017	9
"NIL"	"NIL"	"PROPERTY THEFT"	"BUSHROD ISLAND"	"DUALA COMMUNITY"	"9/10/2017"	"12:00 PM - 03:00 PM"	"WITHDRAWN"	"COMPLETED"	1014	"2017-09-10"	0	0	0	0	0	0	0	0	0	0	0	0	1	2017	9
"NIL"	"NIL"	"AGGRAVATED ASSAULT"	"BUSHROD ISLAND"	"DUALA COMMUNITY"	"9/14/2017"	"09:00 AM - 12:00 PM"	"COURT"	"COMPLETED"	1014	"2017-09-14"	0	0	1	0	0	0	0	0	0	0	0	0	0	2017	9
"NIL"	"NIL"	"PROPERTY THEFT"	"BUSHROD ISLAND"	"DUALA COMMUNITY"	"9/15/2017"	"09:00 AM - 12:00 PM"	"COURT"	"COMPLETED"	1014	"2017-09-15"	0	0	0	0	0	0	0	0	0	0	0	0	1	2017	9
"NIL"	"NIL"	"ROBBERY"	"SINKOR"	"11TH STREET COMMUNITY"	"8/28/2017"	"12:00 PM - 03:00 PM"	"PENDING"	"COMPLETED"	2027	"2017-08-28"	0	1	0	0	0	0	0	0	0	0	0	0	0	2017	8
"NIL"	"NIL"	"ROBBERY"	"CENTRAL MONROVIA"	"BASSA COMMUNITY"	"9/3/2017"	"03:00 AM - 06:00 AM"	"COURT"	"COMPLETED"	2037	"2017-09-03"	0	1	0	0	0	0	0	0	0	0	0	0	0	2017	9
"NIL"	"NIL"	"TERRORISTIC THREAT"	"CENTRAL MONROVIA"	"PHP COMMUNITY"	"9/20/2017"	"06:00 PM - 09:00 PM"	"PENDING"	"COMPLETED"	2004	"2017-09-20"	0	0	0	0	0	0	0	0	0	0	0	0	1	2017	9
"NIL"	"NIL"	"PROPERTY THEFT"	"PAYNESVILLE"	"72ND COMMUNITY"	"8/6/2017"	"06:00 AM - 09:00 AM"	"COURT"	"COMPLETED"	9012	"2017-08-06"	0	0	0	0	0	0	0	0	0	0	0	0	1	2017	8
"NIL"	"NIL"	"AGGRAVATED ASSAULT"	"PAYNESVILLE"	"ELWA COMMUNITY, PAYNESVILLE"	"8/24/2017"	"09:00 PM - 00:00 AM"	"WITHDRAWN"	"COMPLETED"	8005	"2017-08-24"	0	0	1	0	0	0	0	0	0	0	0	0	0	2017	8
"NIL"	"NIL"	"PROPERTY THEFT"	"PAYNESVILLE"	"GSA ROAD COMMUNITY"	"8/22/2017"	"09:00 AM - 12:00 PM"	"COURT"	"COMPLETED"	5002	"2017-08-22"	0	0	0	0	0	0	0	0	0	0	0	0	1	2017	8
"NIL"	"NIL"	"PROPERTY THEFT"	"PAYNESVILLE"	"ELWA COMMUNITY, PAYNESVILLE"	"7/8/2017"	"09:00 AM - 12:00 PM"	"WITHDRAWN"	"COMPLETED"	8005	"2017-07-08"	0	0	0	0	0	0	0	0	0	0	0	0	1	2017	7
"NIL"	"NIL"	"AGGRAVATED ASSAULT"	"PAYNESVILLE"	"R-2 COMMUNITY"	"9/6/2017"	"12:00 PM - 03:00 PM"	"COURT"	"COMPLETED"	8017	"2017-09-06"	0	0	1	0	0	0	0	0	0	0	0	0	0	2017	9
"NIL"	"NIL"	"BURGLARY"	"PAYNESVILLE"	"THINKERVILLAGE COMMUNITY"	"9/10/2017"	"03:00 PM - 06:00 PM"	"WITHDRAWN"	"COMPLETED"	8013	"2017-09-10"	0	1	0	0	0	0	0	0	0	0	0	0	0	2017	9
"NIL"	"NIL"	"PROPERTY THEFT"	"PAYNESVILLE"	"THINKERVILLAGE COMMUNITY"	"9/11/2017"	"09:00 AM - 12:00 PM"	"WITHDRAWN"	"COMPLETED"	8013	"2017-09-11"	0	0	0	0	0	0	0	0	0	0	0	0	1	2017	9
"NIL"	"NIL"	"PROPERTY THEFT"	"BUSHROD ISLAND"	"DUALA COMMUNITY"	"8/31/2017"	"12:00 PM - 03:00 PM"	"COURT"	"COMPLETED"	1014	"2017-08-31"	0	0	0	0	0	0	0	0	0	0	0	0	1	2017	8
"NIL"	"NIL"	"PROPERTY THEFT"	"BUSHROD ISLAND"	"DUALA COMMUNITY"	"8/29/2017"	"12:00 PM - 03:00 PM"	"COURT"	"COMPLETED"	1014	"2017-08-29"	0	0	0	0	0	0	0	0	0	0	0	0	1	2017	8
"NIL"	"NIL"	"PROPERTY THEFT"	"BUSHROD ISLAND"	"DUALA COMMUNITY"	"8/30/2017"	"09:00 AM - 12:00 PM"	"COURT"	"COMPLETED"	1014	"2017-08-30"	0	0	0	0	0	0	0	0	0	0	0	0	1	2017	8
"NIL"	"NIL"	"ROBBERY"	"PAYNESVILLE"	"JOE BAR COMMUNITY"	"8/21/2017"	"09:00 AM - 12:00 PM"	"COURT"	"COMPLETED"	5000	"2017-08-21"	0	1	0	0	0	0	0	0	0	0	0	0	0	2017	8
"NIL"	"NIL"	"ROBBERY"	"PAYNESVILLE"	"GSA ROAD COMMUNITY"	"8/12/2017"	"09:00 AM - 12:00 PM"	"COURT"	"COMPLETED"	5002	"2017-08-12"	0	1	0	0	0	0	0	0	0	0	0	0	0	2017	8
"NIL"	"NIL"	"MISAPPLICATION OF ENTRUSTED PROPERTY"	"PAYNESVILLE"	"GSA ROAD COMMUNITY"	"8/15/2017"	"09:00 AM - 12:00 PM"	"COURT"	"COMPLETED"	5002	"2017-08-15"	0	1	0	0	0	0	0	0	0	0	0	0	0	2017	8
"NIL"	"NIL"	"ROBBERY"	"PAYNESVILLE"	"PEACE ISLAND COMMUNITY"	"7/13/2017"	"06:00 AM - 09:00 AM"	"COURT"	"COMPLETED"	9029	"2017-07-13"	0	1	0	0	0	0	0	0	0	0	0	0	0	2017	7
"NIL"	"NIL"	"BURGLARY"	"PAYNESVILLE"	"72ND COMMUNITY"	"8/19/2017"	"06:00 AM - 09:00 AM"	"WITHDRAWN"	"COMPLETED"	9012	"2017-08-19"	0	1	0	0	0	0	0	0	0	0	0	0	0	2017	8
"NIL"	"NIL"	"AGGRAVATED ASSAULT"	"BUSHROD ISLAND"	"POINT FOUR COMMUNITY"	"8/28/2017"	"09:00 PM - 00:00 AM"	"COURT"	"COMPLETED"	1001	"2017-08-28"	0	0	1	0	0	0	0	0	0	0	0	0	0	2017	8
"NIL"	"NIL"	"AGGRAVATED ASSAULT"	"BUSHROD ISLAND"	"POINT FOUR COMMUNITY"	"8/29/2017"	"09:00 PM - 00:00 AM"	"COURT"	"COMPLETED"	1001	"2017-08-29"	0	0	1	0	0	0	0	0	0	0	0	0	0	2017	8
"NIL"	"NIL"	"AGGRAVATED ASSAULT"	"BUSHROD ISLAND"	"POINT FOUR COMMUNITY"	"8/29/2017"	"06:00 AM - 09:00 AM"	"COURT"	"COMPLETED"	1001	"2017-08-29"	0	0	1	0	0	0	0	0	0	0	0	0	0	2017	8
"NIL"	"NIL"	"MENACING"	"BUSHROD ISLAND"	"POINT FOUR COMMUNITY"	"8/30/2017"	"12:00 PM - 03:00 PM"	"COURT"	"COMPLETED"	1001	"2017-08-30"	0	0	0	0	0	0	0	0	0	0	0	0	1	2017	8
"NIL"	"NIL"	"AGGRAVATED ASSAULT"	"BUSHROD ISLAND"	"POINT FOUR COMMUNITY"	"8/31/2017"	"12:00 PM - 03:00 PM"	"PENDING"	"COMPLETED"	1001	"2017-08-31"	0	0	1	0	0	0	0	0	0	0	0	0	0	2017	8
"NIL"	"NIL"	"AGGRAVATED ASSAULT"	"BUSHROD ISLAND"	"POINT FOUR COMMUNITY"	"9/1/2017"	"03:00 PM - 06:00 PM"	"WITHDRAWN"	"COMPLETED"	1001	"2017-09-01"	0	0	1	0	0	0	0	0	0	0	0	0	0	2017	9
"NIL"	"NIL"	"AGGRAVATED ASSAULT"	"BUSHROD ISLAND"	"POINT FOUR COMMUNITY"	"9/17/2017"	"12:00 PM - 03:00 PM"	"WITHDRAWN"	"COMPLETED"	1001	"2017-09-17"	0	0	1	0	0	0	0	0	0	0	0	0	0	2017	9
"NIL"	"NIL"	"SIMPLE ASSAULT"	"CENTRAL MONROVIA"	"MECHLIN STREET COMMUNITY"	"9/3/2017"	"03:00 PM - 06:00 PM"	"COURT"	"COMPLETED"	2005	"2017-09-03"	0	0	0	1	0	0	0	0	0	0	0	0	0	2017	9
"NIL"	"NIL"	"SIMPLE ASSAULT"	"CENTRAL MONROVIA"	"MECHLIN STREET COMMUNITY"	"9/4/2017"	"09:00 AM - 12:00 PM"	"COURT"	"COMPLETED"	2005	"2017-09-04"	0	0	0	1	0	0	0	0	0	0	0	0	0	2017	9
"NIL"	"NIL"	"DISORDERLY CONDUCT"	"BUSHROD ISLAND"	"PEACE LAND COMMUNITY"	"8/17/2017"	"12:00 PM - 03:00 PM"	"WITHDRAWN"	"COMPLETED"	7011	"2017-08-17"	0	0	0	0	0	0	0	0	0	0	0	0	1	2017	8
"NIL"	"NIL"	"PROPERTY THEFT"	"BUSHROD ISLAND"	"FAITH COMMUNITY"	"8/31/2017"	"03:00 PM - 06:00 PM"	"WITHDRAWN"	"COMPLETED"	7005	"2017-08-31"	0	0	0	0	0	0	0	0	0	0	0	0	1	2017	8
"NIL"	"NIL"	"SIMPLE ASSAULT"	"PAYNESVILLE"	"ELWA COMMUNITY"	"8/20/2017"	"03:00 PM - 06:00 PM"	"WITHDRAWN"	"COMPLETED"	8005	"2017-08-20"	0	0	0	1	0	0	0	0	0	0	0	0	0	2017	8
"NIL"	"NIL"	"PROPERTY THEFT"	"PAYNESVILLE"	"ROCK HILL COMMUNITY"	"8/24/2017"	"03:00 PM - 06:00 PM"	"WITHDRAWN"	"COMPLETED"	2014	"2017-08-24"	0	0	0	0	0	0	0	0	0	0	0	0	1	2017	8
"NIL"	"NIL"	"PROPERTY THEFT"	"PAYNESVILLE"	"ELWA COMMUNITY"	"8/29/2017"	"NIL"	"COURT"	"COMPLETED"	8005	"2017-08-29"	0	0	0	0	0	0	0	0	0	0	0	0	1	2017	8
"NIL"	"NIL"	"PROPERTY THEFT"	"PAYNESVILLE"	"ELWA COMMUNITY"	"9/4/2017"	"06:00 AM - 09:00 AM"	"PENDING"	"COMPLETED"	8005	"2017-09-04"	0	0	0	0	0	0	0	0	0	0	0	0	1	2017	9
"NIL"	"NIL"	"PROPERTY THEFT"	"PAYNESVILLE"	"ELWA COMMUNITY"	"9/15/2017"	"NIL"	"PENDING"	"COMPLETED"	8005	"2017-09-15"	0	0	0	0	0	0	0	0	0	0	0	0	1	2017	9
"NIL"	"NIL"	"CRIMINAL  MISCHIEF"	"PAYNESVILLE"	"PEACE ISLAND COMMUNITY"	"9/1/2017"	"09:00 AM - 12:00 PM"	"WITHDRAWN"	"COMPLETED"	3000	"2017-09-01"	0	0	0	0	0	0	0	0	0	0	0	0	1	2017	9
"NIL"	"NIL"	"PROPERTY THEFT"	"SINKOR"	"TARRR TOWN COMMUNITY"	"9/20/2017"	"06:00 AM - 09:00 AM"	"WITHDRAWN"	"COMPLETED"	3005	"2017-09-20"	0	0	0	0	0	0	0	0	0	0	0	0	1	2017	9
"NIL"	"NIL"	"SIMPLE ASSAULT"	"PAYNESVILLE"	"PEACE ISLAND COMMUNITY"	"9/3/2017"	"03:00 PM - 06:00 PM"	"COURT"	"COMPLETED"	3000	"2017-09-03"	0	0	0	1	0	0	0	0	0	0	0	0	0	2017	9
"NIL"	"NIL"	"CRIMINAL  MISCHIEF"	"PAYNESVILLE"	"PEACE ISLAND COMMUNITY"	"9/3/2017"	"09:00 AM - 12:00 PM"	"COURT"	"COMPLETED"	3000	"2017-09-03"	0	0	0	0	0	0	0	0	0	0	0	0	1	2017	9
"NIL"	"NIL"	"MENACING"	"PAYNESVILLE"	"PEACE ISLAND COMMUNITY"	"9/3/2017"	"09:00 AM - 12:00 PM"	"COURT"	"COMPLETED"	3000	"2017-09-03"	0	0	0	0	0	0	0	0	0	0	0	0	1	2017	9
"NIL"	"NIL"	"BURGLARY"	"BUSHROD ISLAND"	"VAI TOWN COMMUNITY"	"8/7/2017"	"03:00 PM - 06:00 PM"	"PENDING"	"COMPLETED"	3021	"2017-08-07"	0	1	0	0	0	0	0	0	0	0	0	0	0	2017	8
"NIL"	"NIL"	"SEXUAL ABUSE OF WARD"	"BUSHROD ISLAND"	"VAI TOWN COMMUNITY"	"8/26/2017"	"09:00 PM - 00:00 AM"	"PENDING"	"COMPLETED"	3021	"2017-08-26"	0	0	0	0	1	0	0	0	0	0	0	0	0	2017	8
"NIL"	"NIL"	"SIMPLE ASSAULT"	"PAYNESVILLE"	"JOEBAH COMMUNITY"	"8/19/2017"	"03:00 PM - 06:00 PM"	"WITHDRAWN"	"COMPLETED"	5000	"2017-08-19"	0	0	0	1	0	0	0	0	0	0	0	0	0	2017	8
"NIL"	"NIL"	"PROPERTY THEFT"	"SINKOR"	"GAYE TOWN COMMUNITY"	"9/15/2017"	"06:00 AM - 09:00 AM"	"PENDING"	"COMPLETED"	3012	"2017-09-15"	0	0	0	0	0	0	0	0	0	0	0	0	1	2017	9
"NIL"	"NIL"	"MENACING"	"SINKOR"	"GAYE TOWN COMMUNITY"	"9/14/2017"	"09:00 PM - 00:00 AM"	"WITHDRAWN"	"COMPLETED"	3012	"2017-09-14"	0	0	0	0	0	0	0	0	0	0	0	0	1	2017	9
"NIL"	"NIL"	"PROPERTY THEFT"	"SINKOR"	"11TH STREET COMMUNITY"	"9/11/2017"	"06:00 AM - 09:00 AM"	"WITHDRAWN"	"COMPLETED"	2027	"2017-09-11"	0	0	0	0	0	0	0	0	0	0	0	0	1	2017	9
"NIL"	"NIL"	"ROBBERY"	"PAYNESVILLE"	"72ND COMMUNITY"	"8/27/2017"	"09:00 AM - 12:00 PM"	"COURT"	"COMPLETED"	9012	"2017-08-27"	0	1	0	0	0	0	0	0	0	0	0	0	0	2017	8
"NIL"	"NIL"	"BURGLARY"	"PAYNESVILLE"	"72ND COMMUNITY"	"8/27/2017"	"09:00 AM - 12:00 PM"	"WITHDRAWN"	"COMPLETED"	9012	"2017-08-27"	0	1	0	0	0	0	0	0	0	0	0	0	0	2017	8
"NIL"	"NIL"	"MISAPPLICATION OF ENTRUSTED PROPERTY"	"PAYNESVILLE"	"NEE ZOE COMMUNITY "	"8/31/2017"	"12:00 PM - 03:00 PM"	"WITHDRAWN"	"COMPLETED"	9018	"2017-08-31"	0	1	0	0	0	0	0	0	0	0	0	0	0	2017	8
"NIL"	"NIL"	"SIMPLE ASSAULT"	"PAYNESVILLE"	"PEACE ISLAND COMMUNITY"	"9/1/2017"	"06:00 AM - 09:00 AM"	"WITHDRAWN"	"COMPLETED"	9029	"2017-09-01"	0	0	0	1	0	0	0	0	0	0	0	0	0	2017	9
"NIL"	"NIL"	"PROPERTY THEFT"	"PAYNESVILLE"	"NEEZOE COMMUNITY "	"9/2/2017"	"06:00 PM - 09:00 PM"	"WITHDRAWN"	"COMPLETED"	9018	"2017-09-02"	0	0	0	0	0	0	0	0	0	0	0	0	1	2017	9
"NIL"	"NIL"	"SIMPLE ASSAULT"	"PAYNESVILLE"	"72ND COMMUNITY"	"9/8/2017"	"06:00 PM - 09:00 PM"	"WITHDRAWN"	"COMPLETED"	9012	"2017-09-08"	0	0	0	1	0	0	0	0	0	0	0	0	0	2017	9
"NIL"	"NIL"	"PROPERTY THEFT"	"PAYNESVILLE"	"72ND COMMUNITY"	"9/5/2017"	"09:00 AM - 12:00 PM"	"WITHDRAWN"	"COMPLETED"	9012	"2017-09-05"	0	0	0	0	0	0	0	0	0	0	0	0	1	2017	9
"NIL"	"NIL"	"BURGLARY"	"PAYNESVILLE"	"NEE ZOE COMMUNITY "	"9/9/2017"	"12:00 PM - 03:00 PM"	"COURT"	"COMPLETED"	9018	"2017-09-09"	0	1	0	0	0	0	0	0	0	0	0	0	0	2017	9
"NIL"	"NIL"	"PROPERTY THEFT"	"PAYNESVILLE"	"NEW HOPE COMMUNITY"	"9/12/2017"	"09:00 AM - 12:00 PM"	"COURT"	"COMPLETED"	9003	"2017-09-12"	0	0	0	0	0	0	0	0	0	0	0	0	1	2017	9
"NIL"	"NIL"	"PROPERTY THEFT"	"PAYNESVILLE"	"NEE ZOE COMMUNITY "	"9/18/2017"	"09:00 AM - 12:00 PM"	"WITHDRAWN"	"COMPLETED"	9018	"2017-09-18"	0	0	0	0	0	0	0	0	0	0	0	0	1	2017	9
"NIL"	"NIL"	"BURGLARY"	"BUSHROD ISLAND"	"POINT FOUR COMMUNITY"	"9/22/2017"	"12:00 PM - 03:00 PM"	"PENDING"	"COMPLETED"	1001	"2017-09-22"	0	1	0	0	0	0	0	0	0	0	0	0	0	2017	9
"NIL"	"NIL"	"PROPERTY THEFT"	"PAYNESVILLE"	"ZUBAH TOWN COMMUNITY"	"9/10/2017"	"06:00 AM - 09:00 AM"	"WITHDRAWN"	"COMPLETED"	5008	"2017-09-10"	0	0	0	0	0	0	0	0	0	0	0	0	1	2017	9
"NIL"	"NIL"	"PROPERTY THEFT"	"PAYNESVILLE"	"BASSA TOWN COMMUNITY"	"9/4/2017"	"09:00 PM - 00:00 AM"	"COURT"	"COMPLETED"	10020	"2017-09-04"	0	0	0	0	0	0	0	0	0	0	0	0	1	2017	9
"NIL"	"NIL"	"MISAPPLICATION OF ENTRUSTED PROPERTY"	"PAYNESVILLE"	"BASSA TOWN COMMUNITY"	"9/7/2017"	"06:00 AM - 09:00 AM"	"WITHDRAWN"	"COMPLETED"	10020	"2017-09-07"	0	1	0	0	0	0	0	0	0	0	0	0	0	2017	9
"NIL"	"NIL"	"RAPE"	"CENTRAL MONROVIA"	"BASSA TOWN COMMUNITY"	"9/13/2017"	"06:00 AM - 09:00 AM"	"PENDING"	"COMPLETED"	10020	"2017-09-13"	0	0	0	0	1	0	0	0	0	0	0	0	0	2017	9
"NIL"	"NIL"	"RAPE"	"PAYNESVILLE"	"SKD BOULEVARD COMMUNITY"	"9/14/2017"	"06:00 AM - 09:00 AM"	"PENDING"	"COMPLETED"	3014	"2017-09-14"	0	0	0	0	1	0	0	0	0	0	0	0	0	2017	9
"NIL"	"NIL"	"SIMPLE ASSAULT"	"PAYNESVILLE"	"SOUL CLINIC COMMUNITY"	"9/2/2017"	"03:00 PM - 06:00 PM"	"WITHDRAWN"	"COMPLETED"	5014	"2017-09-02"	0	0	0	1	0	0	0	0	0	0	0	0	0	2017	9
"NIL"	"NIL"	"PERSISTENT NON SUPORT"	"BREWERVILLE"	"NEW GEORGIA COMMUNITY"	"9/2/2017"	"09:00 AM - 12:00 PM"	"COURT"	"COMPLETED"	4020	"2017-09-02"	0	0	0	0	0	0	0	0	0	0	0	0	1	2017	9
"NIL"	"NIL"	"PROPERTY THEFT"	"BUSHROD ISLAND"	"NEW GEORGIA COMMUNITY"	"9/11/2017"	"03:00 PM - 06:00 PM"	"PENDING"	"COMPLETED"	4020	"2017-09-11"	0	0	0	0	0	0	0	0	0	0	0	0	1	2017	9
"NIL"	"NIL"	"PROPERTY THEFT"	"BUSHROD ISLAND"	"CLARA TOWN COMMUNITY"	"9/11/2017"	"09:00 AM - 12:00 PM"	"COURT"	"COMPLETED"	10002	"2017-09-11"	0	0	0	0	0	0	0	0	0	0	0	0	1	2017	9
"NIL"	"NIL"	"SIMPLE ASSAULT"	"PAYNESVILLE"	"SOUL CLINIC COMMUNITY"	"9/13/2017"	"12:00 PM - 03:00 PM"	"PENDING"	"COMPLETED"	5014	"2017-09-13"	0	0	0	1	0	0	0	0	0	0	0	0	0	2017	9
"NIL"	"NIL"	"PERSISTENT NON SUPORT"	"PAYNESVILLE"	"THINKERVILLAGE COMMUNITY"	"9/16/2017"	"09:00 AM - 12:00 PM"	"WITHDRAWN"	"COMPLETED"	8013	"2017-09-16"	0	0	0	0	0	0	0	0	0	0	0	0	1	2017	9
"NIL"	"NIL"	"PERSISTENT NON SUPORT"	"PAYNESVILLE"	"GSA ROAD COMMUNITY"	"9/15/2017"	"03:00 PM - 06:00 PM"	"PENDING"	"COMPLETED"	5002	"2017-09-15"	0	0	0	0	0	0	0	0	0	0	0	0	1	2017	9
"NIL"	"NIL"	"RAPE"	"PAYNESVILLE"	"GSA ROAD COMMUNITY"	"9/21/2017"	"03:00 PM - 06:00 PM"	"PENDING"	"COMPLETED"	5002	"2017-09-21"	0	0	0	0	1	0	0	0	0	0	0	0	0	2017	9
"NIL"	"NIL"	"INTERFERING WITH CHILD CUSTODY"	"PAYNESVILLE"	"BASSA TOWN COMMUNITY"	"9/22/2017"	"03:00 PM - 06:00 PM"	"PENDING"	"COMPLETED"	10020	"2017-09-22"	0	0	0	0	0	0	0	0	0	0	0	0	1	2017	9
"NIL"	"NIL"	"MENACING"	"PAYNESVILLE"	"GSA ROAD COMMUNITY"	"9/1/2017"	"03:00 PM - 06:00 PM"	"PENDING"	"COMPLETED"	5002	"2017-09-01"	0	0	0	0	0	0	0	0	0	0	0	0	1	2017	9
"NIL"	"NIL"	"SIMPLE ASSAULT"	"PAYNESVILLE"	"SOUL CLINIC COMMUNITY"	"9/2/2017"	"03:00 PM - 06:00 PM"	"COURT"	"COMPLETED"	5014	"2017-09-02"	0	0	0	1	0	0	0	0	0	0	0	0	0	2017	9
"NIL"	"NIL"	"SIMPLE ASSAULT"	"PAYNESVILLE"	"GSA ROAD COMMUNITY"	"9/3/2017"	"06:00 PM - 09:00 PM"	"WITHDRAWN"	"COMPLETED"	5002	"2017-09-03"	0	0	0	1	0	0	0	0	0	0	0	0	0	2017	9
"NIL"	"NIL"	"ENDANGERING CHILD WELFARE"	"PAYNESVILLE"	"GSA ROAD COMMUNITY"	"9/10/2017"	"03:00 PM - 06:00 PM"	"PENDING"	"COMPLETED"	5002	"2017-09-10"	0	0	0	0	0	0	0	0	0	0	0	0	1	2017	9
"NIL"	"NIL"	"ENDANGERING CHILD WELFARE"	"PAYNESVILLE"	"GSA ROAD COMMUNITY"	"9/9/2017"	"06:00 AM - 09:00 AM"	"WITHDRAWN"	"COMPLETED"	5002	"2017-09-09"	0	0	0	0	0	0	0	0	0	0	0	0	1	2017	9
"NIL"	"NIL"	"PROPERTY THEFT"	"BUSHROD ISLAND"	"JAMAICA ROAD COMMUNITY"	"9/18/2017"	"06:00 AM - 09:00 AM"	"WITHDRAWN"	"COMPLETED"	10020	"2017-09-18"	0	0	0	0	0	0	0	0	0	0	0	0	1	2017	9
"NIL"	"NIL"	"BURGLARY"	"SINKOR"	"GAYE TOWN COMMUNITY"	"9/9/2017"	"03:00 PM - 06:00 PM"	"PENDING"	"COMPLETED"	3012	"2017-09-09"	0	1	0	0	0	0	0	0	0	0	0	0	0	2017	9
"NIL"	"NIL"	"PROPERTY THEFT"	"CENTRAL MONROVIA"	"PHP COMMUNITY"	"9/26/2017"	"09:00 AM - 12:00 PM"	"PENDING"	"COMPLETED"	2004	"2017-09-26"	0	0	0	0	0	0	0	0	0	0	0	0	1	2017	9
"NIL"	"NIL"	"MENACING"	"SINKOR"	"GAYE TOWN COMMUNITY"	"9/14/2017"	"09:00 PM - 00:00 AM"	"PENDING"	"COMPLETED"	3012	"2017-09-14"	0	0	0	0	0	0	0	0	0	0	0	0	1	2017	9
"NIL"	"NIL"	"SIMPLE ASSAULT"	"SINKOR"	"TOGBA CAMP COMMUNITY"	"9/17/2017"	"09:00 PM - 00:00 AM"	"PENDING"	"COMPLETED"	3028	"2017-09-17"	0	0	0	1	0	0	0	0	0	0	0	0	0	2017	9
"NIL"	"NIL"	"PROPERTY THEFT"	"CENTRAL MONROVIA"	"MECHLIN STREET COMMUNITY"	"10/6/2017"	"03:00 PM - 06:00 PM"	"COURT"	"COMPLETED"	2005	"2017-10-06"	0	0	0	0	0	0	0	0	0	0	0	0	1	2017	10
"S"	"NIL"	"CRIMINAL MISCHIEF"	"CENTRAL MONROVIA"	"CAREY STREET COMMUNITY"	"10/1/2017"	"03:00 PM - 06:00 PM"	"WITHDRAWN"	"COMPLETED"	2010	"2017-10-01"	0	0	0	0	0	0	0	0	0	0	0	0	1	2017	10
"NIL"	"NIL"	"SIMPLE ASSAULT"	"CENTRAL MONROVIA"	"MECHLIN STREET COMMUNITY"	"9/27/2017"	"06:00 AM - 09:00 AM"	"WITHDRAWN"	"COMPLETED"	2005	"2017-09-27"	0	0	0	1	0	0	0	0	0	0	0	0	0	2017	9
"NIL"	"NIL"	"SIMPLE ASSAULT"	"BUSHROD ISLAND"	"FAITH COMMUNITY"	"10/3/2017"	"06:00 AM - 09:00 AM"	"WITHDRAWN"	"COMPLETED"	7005	"2017-10-03"	0	0	0	1	0	0	0	0	0	0	0	0	0	2017	10
"NIL"	"NIL"	"PROPERTY THEFT"	"BUSHROD ISLAND"	"DUALA COMMUNITY"	"10/20/2017"	"03:00 PM - 06:00 PM"	"PENDING"	"COMPLETED"	1014	"2017-10-20"	0	0	0	0	0	0	0	0	0	0	0	0	1	2017	10
"NIL"	"NIL"	"BURGLARY"	"CENTRAL MONROVIA"	"UN DRIVE COMMUNITY"	"10/15/2017"	"03:00 AM - 06:00 AM"	"PENDING"	"COMPLETED"	2001	"2017-10-15"	0	1	0	0	0	0	0	0	0	0	0	0	0	2017	10
"NIL"	"NIL"	"BURGLARY"	"CENTRAL MONROVIA"	"UN DRIVE COMMUNITY"	"10/13/2017"	"12:00 PM - 03:00 PM"	"COURT"	"COMPLETED"	2001	"2017-10-13"	0	1	0	0	0	0	0	0	0	0	0	0	0	2017	10
"NIL"	"NIL"	"BURGLARY"	"PAYNESVILLE"	"THINKER VILLAGE COMMUNITY"	"10/16/2017"	"09:00 AM - 12:00 PM"	"COURT"	"COMPLETED"	8013	"2017-10-16"	0	1	0	0	0	0	0	0	0	0	0	0	0	2017	10
"NIL"	"NIL"	"PROPERTY THEFT"	"PAYNESVILLE"	"72ND COMMUNITY"	"9/27/2017"	"09:00 AM - 12:00 PM"	"WITHDRAWN"	"COMPLETED"	9012	"2017-09-27"	0	0	0	0	0	0	0	0	0	0	0	0	1	2017	9
"NIL"	"NIL"	"PERSISTENT NON SUPPORT"	"PAYNESVILLE"	"72ND COMMUNITY"	"10/2/2017"	"12:00 PM - 03:00 PM"	"PENDING"	"COMPLETED"	9012	"2017-10-02"	0	0	0	0	0	0	0	0	0	0	0	0	1	2017	10
"NIL"	"NIL"	"PROPERTY THEFT"	"PAYNESVILLE"	"CHICKEN FARM COMMUNITY"	"10/5/2017"	"12:00 PM - 03:00 PM"	"PENDING"	"COMPLETED"	9006	"2017-10-05"	0	0	0	0	0	0	0	0	0	0	0	0	1	2017	10
"NIL"	"NIL"	"MISAPPLICATION OF ENTRUSTED PROPERTY"	"PAYNESVILLE"	"72ND COMMUNITY"	"10/6/2017"	"09:00 AM - 12:00 PM"	"WITHDRAWN"	"COMPLETED"	9012	"2017-10-06"	0	1	0	0	0	0	0	0	0	0	0	0	0	2017	10
"NIL"	"NIL"	"PROPERTY THEFT"	"PAYNESVILLE"	"PEACE ISLAND COMMUNITY"	"10/7/2017"	"03:00 PM - 06:00 PM"	"COURT"	"COMPLETED"	9029	"2017-10-07"	0	0	0	0	0	0	0	0	0	0	0	0	1	2017	10
"NIL"	"NIL"	"SIMPLE ASSAULT"	"PAYNESVILLE"	"72ND COMMUNITY"	"10/11/2017"	"12:00 PM - 03:00 PM"	"WITHDRAWN"	"COMPLETED"	9012	"2017-10-11"	0	0	0	1	0	0	0	0	0	0	0	0	0	2017	10
"NIL"	"NIL"	"DISORDERLY CONDUCT"	"PAYNESVILLE"	"72ND COMMUNITY"	"10/18/2017"	"06:00 AM - 09:00 AM"	"WITHDRAWN"	"COMPLETED"	9012	"2017-10-18"	0	0	0	0	0	0	0	0	0	0	0	0	1	2017	10
"NIL"	"NIL"	"SIMPLE ASSAULT"	"PAYNESVILLE"	"72ND COMMUNITY"	"10/22/2017"	"09:00 AM - 12:00 PM"	"WITHDRAWN"	"COMPLETED"	9012	"2017-10-22"	0	0	0	1	0	0	0	0	0	0	0	0	0	2017	10
"NIL"	"NIL"	"AGGRAVATED ASSAULT"	"BUSHROD ISLAND"	"POINT FOUR COMMUNITY"	"10/14/2017"	"03:00 AM - 06:00 AM"	"COURT"	"COMPLETED"	1001	"2017-10-14"	0	0	1	0	0	0	0	0	0	0	0	0	0	2017	10
"NIL"	"NIL"	"AGGRAVATED ASSAULT"	"BUSHROD ISLAND"	"BONG MINES BRIDGE COMMUNITY"	"10/15/2017"	"03:00 AM - 06:00 AM"	"COURT"	"COMPLETED"	1002	"2017-10-15"	0	0	1	0	0	0	0	0	0	0	0	0	0	2017	10
"NIL"	"NIL"	"AGGRAVATED ASSAULT"	"BUSHROD ISLAND"	"POINT FOUR COMMUNITY"	"10/13/2017"	"09:00 PM - 00:00 AM"	"COURT"	"COMPLETED"	1001	"2017-10-13"	0	0	1	0	0	0	0	0	0	0	0	0	0	2017	10
"NIL"	"NIL"	"PROPERTY THEFT"	"BUSHROD ISLAND"	"POINT FOUR COMMUNITY"	"10/14/2017"	"03:00 PM - 06:00 PM"	"COURT"	"COMPLETED"	1001	"2017-10-14"	0	0	0	0	0	0	0	0	0	0	0	0	1	2017	10
"NIL"	"NIL"	"PROPERTY THEFT"	"BUSHROD ISLAND"	"BONG MINES BRIDGE COMMUNITY"	"10/7/2017"	"NIL"	"COURT"	"COMPLETED"	1002	"2017-10-07"	0	0	0	0	0	0	0	0	0	0	0	0	1	2017	10
"NIL"	"NIL"	"ROBBERY"	"BUSHROD ISLAND"	"POINT FOUR COMMUNITY"	"10/20/2017"	"06:00 AM - 09:00 AM"	"PENDING"	"COMPLETED"	1001	"2017-10-20"	0	1	0	0	0	0	0	0	0	0	0	0	0	2017	10
"NIL"	"NIL"	"CRIMINAL MISCHIEF"	"BUSHROD ISLAND"	"DUALA COMMUNITY"	"10/3/2017"	"12:00 PM - 03:00 PM"	"WITHDRAWN"	"COMPLETED"	1014	"2017-10-03"	0	0	0	0	0	0	0	0	0	0	0	0	1	2017	10
"NIL"	"NIL"	"SIMPLE ASSAULT"	"BUSHROD ISLAND"	"DUALA COMMUNITY"	"10/4/2017"	"09:00 AM - 12:00 PM"	"WITHDRAWN"	"COMPLETED"	1014	"2017-10-04"	0	0	0	1	0	0	0	0	0	0	0	0	0	2017	10
"NIL"	"NIL"	"PERSISTENT NON SUPPORT"	"BUSHROD ISLAND"	"DUALA COMMUNITY"	"10/5/2017"	"03:00 PM - 06:00 PM"	"COURT"	"COMPLETED"	1014	"2017-10-05"	0	0	0	0	0	0	0	0	0	0	0	0	1	2017	10
"NIL"	"NIL"	"PROPERTY THEFT"	"SINKOR"	"GAYE TOWN COMMUNITY"	"10/4/2017"	"12:00 PM - 03:00 PM"	"WITHDRAWN"	"COMPLETED"	3012	"2017-10-04"	0	0	0	0	0	0	0	0	0	0	0	0	1	2017	10
"NIL"	"NIL"	"PROPERTY THEFT"	"CONGO TOWN"	"PEACE ISLAND COMMUNITY"	"10/8/2017"	"06:00 AM - 09:00 AM"	"WITHDRAWN"	"COMPLETED"	3000	"2017-10-08"	0	0	0	0	0	0	0	0	0	0	0	0	1	2017	10
"NIL"	"NIL"	"PROPERTY THEFT"	"CONGO TOWN"	"PEACE ISLAND COMMUNITY"	"10/15/2017"	"06:00 AM - 09:00 AM"	"PENDING"	"COMPLETED"	3000	"2017-10-15"	0	0	0	0	0	0	0	0	0	0	0	0	1	2017	10
"NIL"	"NIL"	"SIMPLE ASSAULT"	"SINKOR"	"GAYE TOWN COMMUNITY"	"9/20/2017"	"06:00 AM - 09:00 AM"	"WITHDRAWN"	"COMPLETED"	3012	"2017-09-20"	0	0	0	1	0	0	0	0	0	0	0	0	0	2017	9
"NIL"	"NIL"	"CRIMINAL FACILITATION"	"SINKOR"	"KAILONDO COMMUNITY"	"9/20/2017"	"12:00 PM - 03:00 PM"	"WITHDRAWN"	"COMPLETED"	3016	"2017-09-20"	0	0	0	0	0	0	0	0	0	0	0	0	1	2017	9
"NIL"	"NIL"	"AGGRAVATED ASSAULT"	"SINKOR"	"KAILONDO COMMUNITY"	"9/28/2017"	"06:00 PM - 09:00 PM"	"WITHDRAWN"	"COMPLETED"	3016	"2017-09-28"	0	0	1	0	0	0	0	0	0	0	0	0	0	2017	9
"NIL"	"NIL"	"ARSON"	"SINKOR"	"GAYE TOWN COMMUNITY"	"10/16/2017"	"06:00 AM - 09:00 AM"	"PENDING"	"COMPLETED"	3012	"2017-10-16"	0	0	0	0	0	0	0	0	0	0	0	0	1	2017	10
"NIL"	"NIL"	"PROPERTY THEFT"	"PAYNESVILLE"	"SOUL CLINIC COMMUNITY"	"10/6/2017"	"03:00 PM - 06:00 PM"	"WITHDRAWN"	"COMPLETED"	5014	"2017-10-06"	0	0	0	0	0	0	0	0	0	0	0	0	1	2017	10
"NIL"	"NIL"	"DISORDERLY CONDUCT"	"SINKOR"	"17TH STREET COMMUNITY"	"10/14/2017"	"03:00 PM - 06:00 PM"	"WITHDRAWN"	"COMPLETED"	2025	"2017-10-14"	0	0	0	0	0	0	0	0	0	0	0	0	1	2017	10
"NIL"	"NIL"	"AGGRAVATED ASSAULT"	"SINKOR"	"CATHOLIC JUNCTION COMMUNITY"	"10/14/2017"	"00:00 AM - 03:00 AM"	"WITHDRAWN"	"COMPLETED"	3001	"2017-10-14"	0	0	1	0	0	0	0	0	0	0	0	0	0	2017	10
"NIL"	"NIL"	"AGGRAVATED ASSAULT"	"SINKOR"	"CATHOLIC JUNCTION COMMUNITY"	"10/14/2017"	"00:00 AM - 03:00 AM"	"WITHDRAWN"	"COMPLETED"	3001	"2017-10-14"	0	0	1	0	0	0	0	0	0	0	0	0	0	2017	10
"NIL"	"NIL"	"ROBBERY"	"PAYNESVILLE"	"JOE BAR COMMUNITY"	"9/24/2017"	"06:00 PM - 09:00 PM"	"COURT"	"COMPLETED"	5000	"2017-09-24"	0	1	0	0	0	0	0	0	0	0	0	0	0	2017	9
"NIL"	"NIL"	"PROPERTY THEFT"	"BREWERVILLE"	"PERRY TOWN COMMUNITY"	"10/16/2017"	"03:00 AM - 06:00 AM"	"COURT"	"COMPLETED"	6011	"2017-10-16"	0	0	0	0	0	0	0	0	0	0	0	0	1	2017	10
"NIL"	"NIL"	"SIMPLE ASSAULT"	"PAYNESVILLE"	"POLICE ACADEMY COMMUNITY"	"10/7/2017"	"09:00 AM - 12:00 PM"	"WITHDRAWN"	"COMPLETED"	5010	"2017-10-07"	0	0	0	1	0	0	0	0	0	0	0	0	0	2017	10
"NIL"	"NIL"	"PROPERTY THEFT"	"PAYNESVILLE"	"ELWA COMMUNITY"	"8/7/2017"	"09:00 AM - 12:00 PM"	"WITHDRAWN"	"COMPLETED"	8005	"2017-08-07"	0	0	0	0	0	0	0	0	0	0	0	0	1	2017	8
"NIL"	"NIL"	"AGGRAVATED ASSAULT"	"PAYNESVILLE"	"R-2 COMMUNITY"	"9/6/2017"	"09:00 PM - 00:00 AM"	"COURT"	"COMPLETED"	8017	"2017-09-06"	0	0	1	0	0	0	0	0	0	0	0	0	0	2017	9
"NIL"	"NIL"	"PROPERTY THEFT"	"PAYNESVILLE"	"ELWA COMMUNITY"	"9/25/2017"	"12:00 PM - 03:00 PM"	"WITHDRAWN"	"COMPLETED"	8005	"2017-09-25"	0	0	0	0	0	0	0	0	0	0	0	0	1	2017	9
"CUTLASS"	"NIL"	"ARMED ROBBERY"	"PAYNESVILLE"	"VOA COMMUNITY"	"9/22/2017"	"00:00 AM - 03:00 AM"	"COURT"	"COMPLETED"	8004	"2017-09-22"	1	0	0	0	0	0	0	0	0	0	0	0	0	2017	9
"NIL"	"NIL"	"PROPERTY THEFT"	"PAYNESVILLE"	"ELWA COMMUNITY"	"10/6/2017"	"03:00 AM - 06:00 AM"	"PENDING"	"COMPLETED"	8005	"2017-10-06"	0	0	0	0	0	0	0	0	0	0	0	0	1	2017	10
"NIL"	"NIL"	"PROPERTY THEFT"	"PAYNESVILLE"	"ELWA COMMUNITY"	"10/6/2017"	"03:00 PM - 06:00 PM"	"PENDING"	"COMPLETED"	8005	"2017-10-06"	0	0	0	0	0	0	0	0	0	0	0	0	1	2017	10
"NIL"	"NIL"	"SIMPLE ASSAULT"	"PAYNESVILLE"	"REHAB COMMUNITY"	"10/17/2017"	"09:00 AM - 12:00 PM"	"COURT"	"COMPLETED"	8006	"2017-10-17"	0	0	0	1	0	0	0	0	0	0	0	0	0	2017	10
"NIL"	"NIL"	"AGGRAVATED ASSAULT"	"PAYNESVILLE"	"ELWA COMMUNITY"	"10/13/2017"	"09:00 AM - 12:00 PM"	"WITHDRAWN"	"COMPLETED"	8005	"2017-10-13"	0	0	1	0	0	0	0	0	0	0	0	0	0	2017	10
"NIL"	"NIL"	"SIMPLE ASSAULT"	"PAYNESVILLE"	"ELWA COMMUNITY"	"10/17/2017"	"00:00 AM - 03:00 AM"	"WITHDRAWN"	"COMPLETED"	8005	"2017-10-17"	0	0	0	1	0	0	0	0	0	0	0	0	0	2017	10
"NIL"	"NIL"	"PROPERTY THEFT"	"PAYNESVILLE"	"THINKER VILLAGE COMMUNITY"	"8/29/2017"	"06:00 PM - 09:00 PM"	"WITHDRAWN"	"COMPLETED"	8013	"2017-08-29"	0	0	0	0	0	0	0	0	0	0	0	0	1	2017	8
"NIL"	"NIL"	"CRIMINAL TRESPASS"	"PAYNESVILLE"	"THINKER VILLAGE COMMUNITY"	"9/20/2017"	"09:00 AM - 12:00 PM"	"COURT"	"COMPLETED"	8013	"2017-09-20"	0	0	0	0	0	0	0	0	0	0	0	0	1	2017	9
"NIL"	"NIL"	"PROPERTY THEFT"	"PAYNESVILLE"	"THINKER VILLAGE COMMUNITY"	"9/26/2017"	"06:00 AM - 09:00 AM"	"COURT"	"COMPLETED"	8013	"2017-09-26"	0	0	0	0	0	0	0	0	0	0	0	0	1	2017	9
"NIL"	"NIL"	"SIMPLE ASSAULT"	"PAYNESVILLE"	"THINKER VILLAGE COMMUNITY"	"10/13/2017"	"06:00 AM - 09:00 AM"	"PENDING"	"COMPLETED"	8013	"2017-10-13"	0	0	0	1	0	0	0	0	0	0	0	0	0	2017	10
"NIL"	"NIL"	"AGGRAVATED ASSAULT"	"PAYNESVILLE"	"THINKER VILLAGE COMMUNITY"	"10/17/2017"	"09:00 AM - 12:00 PM"	"PENDING"	"COMPLETED"	8013	"2017-10-17"	0	0	1	0	0	0	0	0	0	0	0	0	0	2017	10
"NIL"	"NIL"	"DISORDERLY CONDUCT"	"PAYNESVILLE"	"ZUBAH TOWN COMMUNITY"	"9/19/2018"	"NIL"	"WITHDRAWN"	"COMPLETED"	5008	"2018-09-19"	0	0	0	0	0	0	0	0	0	0	0	0	1	2018	9
"NIL"	"NIL"	"PROPERTY THEFT"	"PAYNESVILLE"	"ELWA COMMUNITY"	"9/21/2017"	"NIL"	"WITHDRAWN"	"COMPLETED"	8005	"2017-09-21"	0	0	0	0	0	0	0	0	0	0	0	0	1	2017	9
"NIL"	"NIL"	"PERSISTENT NON SUPPORT"	"PAYNESVILLE"	"ELWA COMMUNITY"	"9/28/2017"	"09:00 AM - 12:00 PM"	"WITHDRAWN"	"COMPLETED"	8005	"2017-09-28"	0	0	0	0	0	0	0	0	0	0	0	0	1	2017	9
"NIL"	"NIL"	"HIT & RUN"	"PAYNESVILLE"	"ELWA COMMUNITY"	"10/12/2017"	"NIL"	"WITHDRAWN"	"COMPLETED"	8005	"2017-10-12"	0	0	0	0	0	0	0	0	0	0	0	1	0	2017	10
"NIL"	"NIL"	"PROPERTY THEFT"	"PAYNESVILLE"	"THINKER VILLAGE COMMUNITY"	"9/27/2017"	"06:00 AM - 09:00 AM"	"COURT"	"COMPLETED"	8013	"2017-09-27"	0	0	0	0	0	0	0	0	0	0	0	0	1	2017	9
"NIL"	"NIL"	"PROPERTY THEFT"	"BREWERVILLE"	"PERRY TOWN COMMUNITY"	"10/11/2017"	"06:00 PM - 09:00 PM"	"WITHDRAWN"	"COMPLETED"	6011	"2017-10-11"	0	0	0	0	0	0	0	0	0	0	0	0	1	2017	10
"NIL"	"NIL"	"PROPERTY THEFT"	"BREWERVILLE"	"BABY-MA JUNCTION COMMUNITY"	"9/19/2017"	"09:00 AM - 12:00 PM"	"COURT"	"COMPLETED"	6003	"2017-09-19"	0	0	0	0	0	0	0	0	0	0	0	0	1	2017	9
"NIL"	"NIL"	"PERSISTENT NON SUPPORT"	"BUSHROD ISLAND"	"JAMAICA ROAD COMMUNITY"	"10/11/2017"	"03:00 PM - 06:00 PM"	"WITHDRAWN"	"COMPLETED"	10020	"2017-10-11"	0	0	0	0	0	0	0	0	0	0	0	0	1	2017	10
"SINGLE BARREL SHORT GUN"	"NIL"	"POSSESSION & SALE OF PHYSICAL OBJECTS FOR LRTHAL USE"	"PAYNESVILLE"	"THINKER VILLAGE COMMUNITY"	"9/29/2017"	"12:00 PM - 03:00 PM"	"PENDING"	"COMPLETED"	8013	"2017-09-29"	0	0	0	0	0	0	0	0	0	0	0	0	1	2017	9
"SINGLE BARREL SHORT GUN"	"NIL"	"ARMED ROBBERY"	"PAYNESVILLE"	"SOUL CLINIC COMMUNITY"	"10/18/2017"	"00:00 AM - 03:00 AM"	"PENDING"	"COMPLETED"	5014	"2017-10-18"	1	0	0	0	0	0	0	0	0	0	0	0	0	2017	10
"NIL"	"NIL"	"SIMPLE ASSAULT"	"BUSHROD ISLAND"	"DOE COMMUNITY "	"10/1/2017"	"06:00 AM - 09:00 AM"	"WITHDRAWN "	"COMPLETED"	10004	"2017-10-01"	0	0	0	1	0	0	0	0	0	0	0	0	0	2017	10
"NIL"	"NIL"	"AGGRAVATED ASSAULT"	"BUSHROD ISLAND"	"DOE COMMUNITY "	"10/1/2017"	"06:00 AM - 09:00 AM"	"WITHDRAWN "	"COMPLETED"	10004	"2017-10-01"	0	0	1	0	0	0	0	0	0	0	0	0	0	2017	10
"NIL"	"NIL"	"SIMPLE ASSAULT"	"BUSHROD ISLAND"	"DOE COMMUNITY "	"10/3/2017"	"12:00 PM - 03:00 PM"	"COURT"	"COMPLETED"	10004	"2017-10-03"	0	0	0	1	0	0	0	0	0	0	0	0	0	2017	10
"NIL"	"NIL"	"SIMPLE ASSAULT"	"BUSHROD ISLAND"	"DOE COMMUNITY "	"10/3/2017"	"03:00 PM - 06:00 PM"	"WITHDRAWN "	"COMPLETED"	10004	"2017-10-03"	0	0	0	1	0	0	0	0	0	0	0	0	0	2017	10
"NIL"	"NIL"	"SIMPLE ASSAULT"	"BUSHROD ISLAND"	"DOE COMMUNITY "	"10/4/2017"	"03:00 AM - 06:00 AM"	"WITHDRAWN "	"COMPLETED"	10004	"2017-10-04"	0	0	0	1	0	0	0	0	0	0	0	0	0	2017	10
"NIL"	"NIL"	"PROPERTY THEFT"	"BUSHROD ISLAND"	"DOE COMMUNITY "	"10/6/2017"	"09:00 PM - 00:00 AM"	"WITHDRAWN "	"COMPLETED"	10004	"2017-10-06"	0	0	0	0	0	0	0	0	0	0	0	0	1	2017	10
"NIL"	"NIL"	"PROPERTY THEFT"	"BUSHROD ISLAND"	"DOE COMMUNITY "	"10/6/2017"	"09:00 AM - 12:00 PM"	"WITHDRAWN "	"COMPLETED"	10004	"2017-10-06"	0	0	0	0	0	0	0	0	0	0	0	0	1	2017	10
"NIL"	"NIL"	"CRIMINAL MISCHIEF"	"BUSHROD ISLAND"	"DOE COMMUNITY "	"10/8/2017"	"06:00 AM - 09:00 AM"	"WITHDRAWN "	"COMPLETED"	10004	"2017-10-08"	0	0	0	0	0	0	0	0	0	0	0	0	1	2017	10
"NIL"	"NIL"	"SIMPLE ASSAULT"	"BUSHROD ISLAND"	"DOE COMMUNITY "	"10/9/2017"	"06:00 AM - 09:00 AM"	"WITHDRAWN "	"COMPLETED"	10004	"2017-10-09"	0	0	0	1	0	0	0	0	0	0	0	0	0	2017	10
"NIL"	"NIL"	"SIMPLE ASSAULT"	"BUSHROD ISLAND"	"DOE COMMUNITY "	"10/12/2017"	"06:00 PM - 09:00 PM"	"WITHDRAWN "	"COMPLETED"	10004	"2017-10-12"	0	0	0	1	0	0	0	0	0	0	0	0	0	2017	10
"NIL"	"NIL"	"AGGRAVATED ASSAULT"	"BUSHROD ISLAND"	"DOE COMMUNITY "	"10/11/2017"	"12:00 PM - 03:00 PM"	"WITHDRAWN "	"COMPLETED"	10004	"2017-10-11"	0	0	1	0	0	0	0	0	0	0	0	0	0	2017	10
"NIL"	"NIL"	"SIMPLE ASSAULT"	"BUSHROD ISLAND"	"DOE COMMUNITY "	"10/18/2017"	"06:00 PM - 09:00 PM"	"COURT"	"COMPLETED"	10004	"2017-10-18"	0	0	0	1	0	0	0	0	0	0	0	0	0	2017	10
"NIL"	"NIL"	"CRIMINAL FACILITATION"	"BUSHROD ISLAND"	"DOE COMMUNITY "	"10/14/2017"	"03:00 PM - 06:00 PM"	"COURT"	"COMPLETED"	10004	"2017-10-14"	0	0	0	0	0	0	0	0	0	0	0	0	1	2017	10
"NIL"	"NIL"	"DISORDERLY CONDUCT"	"BUSHROD ISLAND"	"DOE COMMUNITY "	"10/14/2017"	"12:00 PM - 03:00 PM"	"WITHDRAWN "	"COMPLETED"	10004	"2017-10-14"	0	0	0	0	0	0	0	0	0	0	0	0	1	2017	10
"NIL"	"NIL"	"PROPERTY THEFT"	"BUSHROD ISLAND"	"DOE COMMUNITY "	"10/18/2017"	"09:00 AM - 12:00 PM"	"WITHDRAWN "	"COMPLETED"	10004	"2017-10-18"	0	0	0	0	0	0	0	0	0	0	0	0	1	2017	10
"NIL"	"NIL"	"PROPERTY THEFT"	"BUSHROD ISLAND"	"DOE COMMUNITY "	"10/16/2017"	"09:00 AM - 12:00 PM"	"WITHDRAWN "	"COMPLETED"	10004	"2017-10-16"	0	0	0	0	0	0	0	0	0	0	0	0	1	2017	10
"NIL"	"NIL"	"PROPERTY THEFT"	"BUSHROD ISLAND"	"DOE COMMUNITY "	"10/11/2017"	"09:00 AM - 12:00 PM"	"WITHDRAWN "	"COMPLETED"	10004	"2017-10-11"	0	0	0	0	0	0	0	0	0	0	0	0	1	2017	10
"NIL"	"NIL"	"PROPERTY THEFT"	"BUSHROD ISLAND"	"DOE COMMUNITY "	"10/19/2017"	"09:00 AM - 12:00 PM"	"WITHDRAWN "	"COMPLETED"	10004	"2017-10-19"	0	0	0	0	0	0	0	0	0	0	0	0	1	2017	10
"NIL"	"NIL"	"PROPERTY THEFT"	"BUSHROD ISLAND"	"DOE COMMUNITY "	"10/19/2017"	"09:00 AM - 12:00 PM"	"PENDING"	"COMPLETED"	10004	"2017-10-19"	0	0	0	0	0	0	0	0	0	0	0	0	1	2017	10
"NIL"	"NIL"	"PROPERTY THEFT"	"BUSHROD ISLAND"	"DOE COMMUNITY "	"10/19/2017"	"06:00 PM - 09:00 PM"	"PENDING"	"COMPLETED"	10004	"2017-10-19"	0	0	0	0	0	0	0	0	0	0	0	0	1	2017	10
"NIL"	"NIL"	"PROPERTY THEFT"	"BUSHROD ISLAND"	"JAMAICA ROAD COMMUNITY"	"10/1/2017"	"09:00 AM - 12:00 PM"	"PENDING"	"COMPLETED"	10020	"2017-10-01"	0	0	0	0	0	0	0	0	0	0	0	0	1	2017	10
"NIL"	"NIL"	"SIMPLE ASSAULT"	"BUSHROD ISLAND"	"JAMAICA ROAD COMMUNITY"	"10/1/2017"	"06:00 AM - 09:00 AM"	"WITHDRAWN "	"COMPLETED"	10020	"2017-10-01"	0	0	0	1	0	0	0	0	0	0	0	0	0	2017	10
"NIL"	"NIL"	"AGGRAVATED ASSAULT"	"BUSHROD ISLAND"	"CLARA TOWN COMMUNITY"	"10/1/2017"	"09:00 AM - 12:00 PM"	"WITHDRAWN "	"COMPLETED"	10002	"2017-10-01"	0	0	1	0	0	0	0	0	0	0	0	0	0	2017	10
"NIL"	"NIL"	"AGGRAVATED ASSAULT"	"BUSHROD ISLAND"	"CLARA TOWN COMMUNITY"	"10/1/2017"	"09:00 AM - 12:00 PM"	"WITHDRAWN "	"COMPLETED"	10002	"2017-10-01"	0	0	1	0	0	0	0	0	0	0	0	0	0	2017	10
"NIL"	"NIL"	"AGGRAVATED ASSAULT"	"BUSHROD ISLAND"	"CLARA TOWN COMMUNITY"	"10/2/2017"	"09:00 AM - 12:00 PM"	"WITHDRAWN "	"COMPLETED"	10002	"2017-10-02"	0	0	1	0	0	0	0	0	0	0	0	0	0	2017	10
"NIL"	"NIL"	"BURGLARY"	"BUSHROD ISLAND"	"JAMAICA ROAD COMMUNITY"	"10/3/2017"	"09:00 AM - 12:00 PM"	"WITHDRAWN "	"COMPLETED"	10020	"2017-10-03"	0	1	0	0	0	0	0	0	0	0	0	0	0	2017	10
"NIL"	"NIL"	"PROPERTY THEFT"	"BUSHROD ISLAND"	"CLARA TOWN COMMUNITY"	"10/3/2017"	"06:00 PM - 09:00 PM"	"COURT"	"COMPLETED"	10002	"2017-10-03"	0	0	0	0	0	0	0	0	0	0	0	0	1	2017	10
"NIL"	"NIL"	"SIMPLE ASSAULT"	"BUSHROD ISLAND"	"CLARA TOWN COMMUNITY"	"10/5/2017"	"06:00 PM - 09:00 PM"	"PENDING"	"COMPLETED"	10002	"2017-10-05"	0	0	0	1	0	0	0	0	0	0	0	0	0	2017	10
"NIL"	"NIL"	"PROPERTY THEFT"	"BUSHROD ISLAND"	"CLARA TOWN COMMUNITY"	"10/7/2017"	"12:00 PM - 03:00 PM"	"WITHDRAWN "	"COMPLETED"	10002	"2017-10-07"	0	0	0	0	0	0	0	0	0	0	0	0	1	2017	10
"NIL"	"NIL"	"PROPERTY THEFT"	"BUSHROD ISLAND"	"DOE COMMUNITY "	"10/8/2017"	"03:00 AM - 06:00 AM"	"PENDING"	"COMPLETED"	10004	"2017-10-08"	0	0	0	0	0	0	0	0	0	0	0	0	1	2017	10
"NIL"	"NIL"	"PROPERTY THEFT"	"BUSHROD ISLAND"	"CLARA TOWN COMMUNITY"	"10/8/2017"	"09:00 AM - 12:00 PM"	"WITHDRAWN "	"COMPLETED"	10002	"2017-10-08"	0	0	0	0	0	0	0	0	0	0	0	0	1	2017	10
"NIL"	"NIL"	"PROPERTY THEFT"	"PAYNESVILLE"	"ELWA COMMUNITY"	"8/7/2017"	"09:00 AM - 12:00 PM"	"WITHDRAWN "	"COMPLETED"	8005	"2017-08-07"	0	0	0	0	0	0	0	0	0	0	0	0	1	2017	8
"NIL"	"NIL"	"AGGRAVATED ASSAULT"	"PAYNESVILLE"	"R-2 COMMUNITY"	"9/6/2017"	"09:00 PM - 00:00 AM"	"COURT"	"COMPLETED"	8017	"2017-09-06"	0	0	1	0	0	0	0	0	0	0	0	0	0	2017	9
"NIL"	"NIL"	"PROPERTY THEFT"	"PAYNESVILLE"	"VOA COMMUNITY"	"9/18/2017"	"12:00 PM - 03:00 PM"	"COURT"	"COMPLETED"	8004	"2017-09-18"	0	0	0	0	0	0	0	0	0	0	0	0	1	2017	9
"NIL"	"NIL"	"PROPERTY THEFT"	"PAYNESVILLE"	"ELWA COMMUNITY"	"9/25/2017"	"12:00 PM - 03:00 PM"	"WITHDRAWN "	"COMPLETED"	8005	"2017-09-25"	0	0	0	0	0	0	0	0	0	0	0	0	1	2017	9
"NIL"	"NIL"	"ARMED ROBBERY"	"PAYNESVILLE"	"VOA COMMUNITY"	"9/22/2017"	"12:00 PM - 03:00 PM"	"COURT"	"COMPLETED"	8004	"2017-09-22"	1	0	0	0	0	0	0	0	0	0	0	0	0	2017	9
"NIL"	"NIL"	"PROPERTY THEFT"	"PAYNESVILLE"	"ELWA COMMUNITY"	"10/6/2017"	"03:00 AM - 06:00 AM"	"PENDING"	"COMPLETED"	8005	"2017-10-06"	0	0	0	0	0	0	0	0	0	0	0	0	1	2017	10
"NIL"	"NIL"	"PROPERTY THEFT"	"PAYNESVILLE"	"ELWA COMMUNITY"	"10/6/2017"	"03:00 PM - 06:00 PM"	"PENDING"	"COMPLETED"	8005	"2017-10-06"	0	0	0	0	0	0	0	0	0	0	0	0	1	2017	10
"NIL"	"NIL"	"MISAPPLICATION OF ENTRUSTED PROPERTY"	"PAYNESVILLE"	"VOCKER MISSION COMMUNITY"	"10/1/2017"	"09:00 AM - 12:00 PM"	"COURT"	"COMPLETED"	5015	"2017-10-01"	0	1	0	0	0	0	0	0	0	0	0	0	0	2017	10
"NIL"	"NIL"	"MENACING"	"PAYNESVILLE"	"POLICE ACADEMY COMMUNITY"	"10/16/2017"	"09:00 AM - 12:00 PM"	"COURT"	"COMPLETED"	5010	"2017-10-16"	0	0	0	0	0	0	0	0	0	0	0	0	1	2017	10
